id,name,type,status,price,sale_price,currency,category,url,sold_quantity,rating,problems_solved,description
421756130,التقديم على قرض الزواج,service,hidden,458.85,,SAR,,https://salatips.com/ar/التقديم-على-قرض-الزواج/p421756130,0,0,خدمة حكومية/إدارية — غير مرتبطة بتحليل المتجر (تجاهلها في التوصيات),خدمة التقديم على قرض الزواج تتيح خدمة التقديم على قرض الزواج في المملكة العربية السعودية للشباب المقبلين على الزواج الحصول على دعم مالي لتسهيل أمور الزواج. هذا القرض يُقدّم من بنك التنمية الاجتماعية ويهدف إلى مساعدة الشباب في تكاليف الزواج وتخفيف العبء المالي عنهم. 💍💵 متطلبات الخدمة: يلزم تقديم كافة المتطلبات أدناه بعد طلب الخدمة ليتمكن مزود الخدمة من بدء التنفيذ: الهوية الوطنية : تقديم نسخة من الهوية الوطنية للمتقدم. سجل الأسرة : تقديم نسخة من سجل الأسرة أو عقد الزواج. إثبات الدخل : تقديم شهادة تعريف بالراتب أو كشف حساب بنكي يوضح الدخل الشهري. شهادة توجيهية : إذا كان المتقدم موظفاً حكومياً، يجب تقديم شهادة توجيهية من جهة العمل. شهادة حضور دورة توعوية : بعض البنوك تتطلب حضور دورة توعوية حول الزواج والحياة الزوجية. استمارة الطلب : تعبئة استمارة طلب قرض الزواج المتوفرة على موقع بنك التنمية الاجتماعية. مميزات الخدمة: دعم مالي ميسر : قرض بدون فوائد يساهم في تغطية تكاليف الزواج الأساسية. شروط سداد ميسرة : فترات سداد مرنة تناسب الشباب في بداية حياتهم. تعزيز الاستقرار الأسري : المساعدة في بناء أسرة مستقرة من خلال دعم الشباب المقبلين على الزواج. إجراءات سريعة وبسيطة : توفير خدمة التقديم الإلكتروني لتسهيل الإجراءات. كيفية التقديم على الخدمة: زيارة موقع بنك التنمية الاجتماعية : الدخول إلى الموقع الرسمي لبنك التنمية الاجتماعية. تسجيل الدخول : تسجيل الدخول باستخدام حساب أبشر. اختيار خدمة قرض الزواج : اختيار خدمة قرض الزواج من قائمة الخدمات المتاحة. تعبئة الطلب الإلكتروني : تعبئة الطلب الإلكتروني وإرفاق المستندات المطلوبة. تقديم الطلب : مراجعة الطلب والتأكد من صحة المعلومات المقدمة ثم تقديمه. لماذا تختار خدماتنا لتنفيذ هذه الخدمة؟ خبرة واسعة : يمتلك فريقنا خبرة طويلة في تقديم الاستشارات المالية ودعم الشباب المقبلين على الزواج. سمعة ممتازة : نحن معروفون بتقديم خدمات عالية الجودة ونتائج متميزة. موثوقية : نلتزم بأعلى معايير الجودة ونضمن لك تجربة سلسة وفعالة. التزام بالمواعيد : نحرص على تقديم الخدمة في الوقت المناسب مما يعزز من رضاك وثقتك في خدماتنا. جودة لا مثيل لها : نحرص على توفير خدمات ذات جودة عالية تفوق توقعاتك. خيارات دفع مرنة : نقدم مجموعة متنوعة من خيارات الدفع التي تناسب جميع الأوضاع المالية. 📌 ملاحظات: نحن هنا لمساعدتك في التقديم على قرض الزواج ونضمن تقديم خدمة عالية الجودة تعزز من فرصك في الحصول على القرض. 🚀💼 استفد من الفرص واستثمر في مستقبلك الزوجي! طلب خدمة التقديم على قرض الزواج الآن واستفد من الدعم المالي والثقة التي ستمنحها لك هذه الخدمة. سنكون هنا لدعمك في تحقيق أهدافك وبناء أسرة مستقرة وسعيدة. 🌟💑📈
1992432460,التقديم على قرض العمل الحر,service,hidden,113.85,,SAR,,https://salatips.com/ar/التقديم-على-قرض-العمل-الحر/p1992432460,0,0,خدمة حكومية/إدارية — غير مرتبطة بتحليل المتجر (تجاهلها في التوصيات),"خدمة التقديم على قرض العمل الحر في المملكة العربية السعودية تهدف إلى مساعدة الأفراد في الحصول على التمويل اللازم لبدء أو تطوير مشاريعهم الخاصة. القرض المقدم من بنك التنمية الاجتماعية يسهم في تمكين السعوديين من الاستفادة من إمكاناتهم وتحقيق أهدافهم المهنية. تركز هذه الخدمة على توفير الدعم اللازم لتقديم الطلب بشكل صحيح وضمان تلبية جميع المتطلبات لزيادة فرص الموافقة على القرض. 📋🏦 متطلبات الخدمة في المملكة العربية السعودية: 1️⃣ الهوية الوطنية: يجب أن يكون المتقدم سعودي الجنسية. تقديم نسخة من الهوية الوطنية سارية المفعول. 2️⃣ العمر: يجب أن يكون عمر المتقدم بين 18 و60 عامًا. 3️⃣ العمل: يجب أن يكون المتقدم غير موظف أو موظف براتب لا يزيد عن 14,000 ريال سعودي. تقديم وثيقة العمل الحر المعتمدة من وزارة الموارد البشرية والتنمية الاجتماعية. 4️⃣ السجل الائتماني: يجب أن يكون السجل الائتماني للمتقدم خاليًا من التعثرات المالية. 5️⃣ الدخل: تقديم كشف حساب بنكي لآخر 3 أشهر. تقديم مستندات الدخل الحالية (إن وجدت) مثل عقود إيجار أو إثباتات دخل أخرى. 6️⃣ الخطة: تقديم خطة عمل تفصيلية للمشروع تشمل الأهداف، الإجراءات، والميزانية المتوقعة. 7️⃣ الكفيل: تقديم كفيل غارم إذا كان المتقدم غير موظف حكومي. 8️⃣ التدريب: في بعض الحالات، قد يتطلب التقديم اجتياز دورة تدريبية معتمدة. ما هي المميزات والمنافع التي ستحصل عليها بعد شرائك الخدمة: 1️⃣ سهولة الإجراءات: تضمن الخدمة عملية تقديم ميسرة وسلسة لقرض العمل الحر. 2️⃣ زيادة فرص الموافقة: تقديم الطلب بشكل صحيح يزيد من فرص الموافقة على القرض. 3️⃣ توفير الوقت والجهد: الخدمة توفر الوقت والجهد المبذولين في تجهيز وتقديم الأوراق اللازمة بشكل فردي. 4️⃣ الدعم الشامل: الحصول على دعم شامل في جميع مراحل عملية التقديم، من التحضير إلى الموافقة النهائية. 5️⃣ الاستفادة من التمويل: يمكنك استخدام التمويل لبدء أو تطوير مشروعك وزيادة دخلك. لماذا تختار خبراء المنصات لتنفيذ هذه الخدمة؟ 1️⃣ خبرة واسعة: فريقنا يتمتع بخبرة واسعة في مجال التقديم على القروض وتمويل المشاريع. 2️⃣ جودة الخدمة: نحن نضمن تقديم خدمات عالية الجودة وفقًا للمعايير واللوائح المعمول بها. 3️⃣ كفاءة وسرعة: نلتزم بتقديم الخدمة بكفاءة وسرعة، مع التأكد من استيفاء جميع المتطلبات بدقة. 4️⃣ دعم مستمر: نقدم دعمًا مستمرًا للإجابة على استفساراتك ومساعدتك في أي مرحلة من مراحل التقديم. 5️⃣ التزام بالمواعيد: نعمل بجدية لتسليم الخدمة في الوقت المناسب ودون تأخير. 📌 نحن هنا لمساعدتك في التقديم على قرض العمل الحر وضمان حصولك على التمويل اللازم لبدء أو تطوير مشروعك. استثمر في تحقيق أهدافك المهنية واطلب خدمتنا الآن لبدء عملية التقديم بكل يسر وسهولة. ضمان الخدمة: سيتم ارجاع كامل المبلغ في حال عدم اكتمال عملية التقديم. 🚀💼 استفد من الفرص المتاحة واستثمر في تطوير عملك! طلب خدمة التقديم على قرض العمل الحر الآن واستفد من الدعم المالي الذي تستحقه. سنكون هنا لدعمك في تحقيق أهدافك التجارية والتنموية. 🌟📈"
1083378687,التسجيل في دعم توصيل الطلبات,service,hidden,113.85,,SAR,,https://salatips.com/ar/التسجيل-في-دعم-توصيل-الطلبات/p1083378687,0,0,مشاكل أو نقص في إعداد الشحن والتوصيل | التوثيق والمتطلبات النظامية (معروف/وثيقة عمل حر/جمارك),"خدمة التسجيل في دعم توصيل الطلبات تهدف إلى مساعدة الأفراد العاطلين عن العمل في الحصول على دعم مالي من الحكومة لتحسين مستوى معيشتهم وزيادة دخلهم من خلال تقديم خدمات توصيل الطلبات. يُمنح الدعم بناءً على الجهد الشخصي المبذول في توصيل الطلبات، حيث يتراوح مبلغ الدعم من 400 إلى 3000 ريال شهريًا ويستمر لمدة سنتين. 📋🏦 متطلبات الخدمة: 1️⃣ يجب أن يكون المتقدم غير موظف. 2️⃣ يجب أن يكون عمر المتقدم بين 18 و60 سنة (بالتقويم الميلادي). 3️⃣ يجب أن يكون المتقدم مسجلاً في إحدى برامج التوصيل المعترف بها. 4️⃣ يجب أن يكون لدى المتقدم وثيقة عمل حر بمسمى ""توصيل الطلبات"". إذا لم تكن لديك الوثيقة، يمكنك طلبها من المتجر. ما هي المميزات والمنافع التي ستحصل عليها بعد شرائك الخدمة: 1️⃣ توسيع دخلك: يمكنك زيادة دخلك الشهري بناءً على الجهد الشخصي في توصيل الطلبات. 2️⃣ التوافق مع الضمان الاجتماعي: الدعم يتوافق مع برامج الضمان الاجتماعي. 3️⃣ التوافق مع حساب المواطن: يمكن الحصول على الدعم بجانب برنامج حساب المواطن. 4️⃣ التوافق مع دعم ريف: يمكنك الاستفادة من الدعم بجانب برنامج دعم ريف. مثال للدعم: عند توصيل 200 طلب شهريًا، تحصل على دعم قدره 3000 ريال. عند توصيل 150 طلب شهريًا، تحصل على دعم قدره 2250 ريال. عند توصيل 100 طلب شهريًا، تحصل على دعم قدره 1500 ريال. عند توصيل 50 طلب شهريًا، تحصل على دعم قدره 750 ريال. لماذا تختار خبراء المنصات لتنفيذ هذه الخدمة؟ 1️⃣ خبرة واسعة: فريقنا يتمتع بخبرة واسعة في مجال التسجيل في برنامج دعم توصيل الطلبات. 2️⃣ جودة الخدمة: نحن نضمن تقديم خدمات عالية الجودة وفقًا للمعايير واللوائح المعمول بها. 3️⃣ كفاءة وسرعة: نلتزم بتقديم الخدمة بكفاءة وسرعة، مع التأكد من استيفاء جميع المتطلبات بدقة. 4️⃣ دعم مستمر: نقدم دعمًا مستمرًا للإجابة على استفساراتك ومساعدتك في أي مرحلة من مراحل التسجيل. 5️⃣ التزام بالمواعيد: نعمل بجدية لتسليم الخدمة في الوقت المناسب ودون تأخير. 📌 نحن هنا لمساعدتك في التسجيل في برنامج دعم توصيل الطلبات وضمان حصولك على الدعم المالي المستحق. استثمر في تطوير عملك واطلب خدمتنا الآن لبدء عملية التسجيل بكل يسر وسهولة. ضمان الخدمة: سيتم ارجاع كامل المبلغ في حال عدم اكتمال عملية التسجيل. 🚀📦 استفد من الفرص المتاحة واستثمر في تحسين مستوى معيشتك وزيادة دخلك! طلب خدمة التسجيل في دعم توصيل الطلبات الآن واستفد من الدعم المالي الذي تستحقه. سنكون هنا لدعمك في تحقيق أهدافك المالية والاجتماعية. 🌟📈"
1207707221,التسجيل في دعم ريف,service,hidden,228.85,,SAR,,https://salatips.com/ar/التسجيل-في-دعم-ريف/p1207707221,0,0,خدمة حكومية/إدارية — غير مرتبطة بتحليل المتجر (تجاهلها في التوصيات),خدمة التسجيل في دعم ريف تهدف إلى تسهيل عملية تسجيل المزارعين والأسر الريفية في برنامج دعم ريف، الذي يهدف إلى تحسين مستوى المعيشة وزيادة الإنتاجية الزراعية في المناطق الريفية. تتيح هذه الخدمة للأفراد تقديم معلوماتهم الشخصية والمالية والزراعية بشكل صحيح لضمان حصولهم على الدعم المقدم من البرنامج. 📋🏦 متطلبات الخدمة: 1️⃣ تقديم بيانات الهوية الشخصية (مثل الأرقام الوطنية، الجنسية). 2️⃣ تقديم بيانات الاتصال والعنوان الحالي. 3️⃣ تقديم معلومات دقيقة عن الأنشطة الزراعية (مثل نوع المحاصيل أو المنتجات الزراعية، مساحة الأرض الزراعية، حجم الإنتاج). 4️⃣ تقديم مستندات داعمة مثل شهادات الزراعة أو عقود الأراضي. ما هي المميزات والمنافع التي ستحصل عليها بعد شرائك الخدمة: 1️⃣ سهولة الإجراءات: تضمن الخدمة عملية تسجيل ميسرة وسلسة في برنامج دعم ريف. 2️⃣ ضمان الحصول على الدعم: يساعد التسجيل الصحيح على ضمان حصولك على الدعم المالي والفني المستحق. 3️⃣ تحسين الإنتاجية: الدعم المقدم يساعد في تحسين الإنتاجية الزراعية وزيادة الدخل. 4️⃣ الامتثال للقوانين: يضمن التسجيل التزامك بالقوانين واللوائح المعمول بها في برنامج دعم ريف. 5️⃣ توفير الوقت والجهد: الخدمة توفر الوقت والجهد المبذولين في جمع وتقديم المعلومات بشكل يدوي. لماذا تختار خبراء المنصات لتنفيذ هذه الخدمة؟ 1️⃣ خبرة واسعة: فريقنا يتمتع بخبرة واسعة في مجال التسجيل في برنامج دعم ريف. 2️⃣ جودة الخدمة: نحن نضمن تقديم خدمات عالية الجودة وفقًا للمعايير واللوائح المعمول بها. 3️⃣ كفاءة وسرعة: نلتزم بتقديم الخدمة بكفاءة وسرعة، مع التأكد من استيفاء جميع المتطلبات بدقة. 4️⃣ دعم مستمر: نقدم دعمًا مستمرًا للإجابة على استفساراتك ومساعدتك في أي مرحلة من مراحل التسجيل. 5️⃣ التزام بالمواعيد: نعمل بجدية لتسليم الخدمة في الوقت المناسب ودون تأخير. 📌 نحن هنا لمساعدتك في التسجيل في برنامج دعم ريف وضمان حصولك على الدعم المالي والفني المستحق. استثمر في مستقبلك الزراعي واطلب خدمتنا الآن لبدء عملية التسجيل بكل يسر وسهولة. ضمان الخدمة: سيتم ارجاع كامل المبلغ في حال عدم اكتمال عملية التسجيل. 🚀🌾 استفد من الفرص المتاحة واستثمر في تحسين مستوى معيشتك وزيادة إنتاجيتك الزراعية! طلب خدمة التسجيل في دعم ريف الآن واستفد من الدعم المالي والفني الذي تستحقه. سنكون هنا لدعمك في تحقيق أهدافك الزراعية والتنموية. 🌟📈
1804177372,رفع اعتراض في الضمان الاجتماعي,service,hidden,113.85,,SAR,الخدمات الحكومية,https://salatips.com/ar/رفع-اعتراض-في-الضمان-الاجتماعي/p1804177372,0,0,خدمة حكومية/إدارية — غير مرتبطة بتحليل المتجر (تجاهلها في التوصيات),خدمة رفع اعتراض في الضمان الاجتماعي تهدف إلى مساعدة الأفراد في تقديم اعتراضات على قرارات الضمان الاجتماعي، مثل رفض طلبات التسجيل أو عدم الاستفادة من بعض المزايا. توفر هذه الخدمة الدعم اللازم لتقديم الاعتراض بشكل صحيح ومتابعته حتى يتم البت فيه. 📋🏦 متطلبات الخدمة: 1️⃣ تقديم بيانات الهوية الشخصية 2️⃣ توضيح سبب الاعتراض بشكل مفصل ودقيق. 3️⃣ تقديم مستندات داعمة تثبت صحة الاعتراض (مثل شهادات، مستندات دخل، عقود، إلخ). 4️⃣ تعبئة نموذج الاعتراض المخصص من قبل الضمان الاجتماعي. ما هي المميزات والمنافع التي ستحصل عليها بعد شرائك الخدمة: 1️⃣ توجيه متخصص : يقدم خبراؤنا توجيهًا متخصصًا لضمان تقديم الاعتراض بشكل صحيح ومهني. 2️⃣ زيادة فرص القبول : تقديم الاعتراض بطريقة احترافية يزيد من فرص قبوله من قبل الضمان الاجتماعي. 3️⃣ متابعة مستمرة : متابعة مستمرة لحالة الاعتراض والتواصل مع الجهات المعنية حتى يتم البت فيه. 4️⃣ توفير الوقت والجهد: الخدمة توفر لك الوقت والجهد المبذولين في تجهيز وتقديم الاعتراض بشكل فردي. 5️⃣ دعم شامل: الحصول على دعم شامل في جميع مراحل عملية الاعتراض، من التحضير إلى القرار النهائي. 📌 نحن هنا لمساعدتك في رفع اعتراضك على قرارات الضمان الاجتماعي وضمان حصولك على الحقوق التي تستحقها. استثمر في حقوقك واطلب خدمتنا الآن لتقديم اعتراضك بكل يسر وسهولة. ضمان الخدمة: سيتم ارجاع كامل المبلغ في حال عدم اكتمال عملية تقديم الاعتراض.
96685662,التسجيل في الضمان الاجتماعي المطور,service,hidden,113.85,,SAR,الخدمات الحكومية,https://salatips.com/ar/التسجيل-في-الضمان-الاجتماعي-المطور/p96685662,0,0,خدمة حكومية/إدارية — غير مرتبطة بتحليل المتجر (تجاهلها في التوصيات),خدمة التسجيل في الضمان الاجتماعي المطور تهدف إلى تسهيل عملية تسجيل الأفراد في نظام التأمينات الاجتماعية المحسّن والمطور. يتضمن ذلك إدخال المعلومات الضرورية للفرد وإكمال الإجراءات المطلوبة لتفعيل اشتراكهم وضمان حصولهم على جميع الفوائد المتاحة وفقًا للقوانين واللوائح الحالية. 📋🏦 متطلبات الخدمة: 1️⃣ تقديم بيانات الهوية الشخصية للفرد (مثل الرقم الوطني، الجنسية، تاريخ الميلاد). 2️⃣ تقديم بيانات الاتصال والعنوان الحالي للفرد. 3️⃣ تقديم مستندات داعمة مثل جواز السفر أو البطاقة الوطنية. ما هي المميزات والمنافع التي ستحصل عليها بعد شرائك الخدمة: 1️⃣ تيسير الإجراءات: خدمة التسجيل توفر عملية سلسة وميسرة لتسجيل الأفراد في الضمان الاجتماعي المطور. 2️⃣ ضمان الحقوق: يضمن التسجيل الكامل حقوق الفرد في استفادة من الخدمات والفوائد التي يوفرها الضمان الاجتماعي. 3️⃣ الامتثال للقوانين: يضمن التسجيل امتثال الفرد للقوانين الجديدة والمحسّنة فيما يتعلق بالضمان الاجتماعي. 📌 نحن هنا لمساعدتك في التسجيل في الضمان الاجتماعي المطور، وضمان استفادتك الكاملة من الفوائد المتاحة. استثمر في مستقبلك الاجتماعي واطلب خدمتنا الآن لبدء عملية التسجيل بكل يسر وسهولة.
