id,name,type,status,price,sale_price,currency,category,url,sold_quantity,rating,problems_solved,description
657003643,تحسين السيو الخارجي وبناء باك لينكس قوي لمتجرك,service,sale,1149,,SAR,تحسين محركات البحث (SEO),https://salatips.com/ar/تحسين-وتطوير-السيو-الخارجي-seo/p657003643,72,5,تصميم وواجهة المتجر غير احترافية / تجربة استخدام ضعيفة | ضعف الظهور في محركات البحث / قلة الزيارات (SEO) | عدم وجود دومين/نطاق خاص بالمتجر | خيارات دفع محدودة / لا يوجد تقسيط | ضعف التسويق وإدارة حسابات التواصل الاجتماعي | المتجر جديد / يحتاج تأسيس كامل | الحاجة لتقييم/تحليل شامل للمتجر | نقص المعرفة/المهارة في إدارة المتجر,"🚀 خدمة تحسين السيو الخارجي وبناء الباك لينكس القوي لمتجرك تهدف إلى تحسين متجرك على محركات البحث وزيادة جودته في نتائج البحث بالإضافة لزيادة الروابط الخارجية المؤثرة ذات الجودة العالية التي تشير إلى متجرك على الإنترنت. وهي تعتبر إشارات هامة لمحركات البحث لتقييم مصداقية وشعبية موقعك. 🌐 مواصفات الخدمة : 1 يتم وضع استراتيجية شاملة لبناء الروابط الخارجية ويتم تحديد المواقع القوية لبناء فيها الروابط ذات الجودة العالية والتي تشير إلى متجرك. 🎯 2 يتم إنشاء محتوى عن متجرك ذو جودة عالية وقيمة لمشاركته في المواقع الأخرى التي يستهدف جمهورك المستهدف. 📝 3 يتم متابعة الروابط وقياس أثرها على تصنيف متجرك في محركات البحث. 📈 4 يتم تزويدك بتقارير حول عدد الروابط وجودتها وتأثيرها على حركة المرور وتصنيف متجرك. 📊 ما هي المميزات والمنافع التي ستحصل عليها بعد شرائك الخدمة 1 كتابة وصف عن متجرك بطريقة جذابة وملفتة للانتباه لعمل الروابط. 📢 2 تساعدك الخدمة على زيادة ترتيب موقعك في نتائج محركات البحث الأولى. 📈 3 من خلال بناء الروابط الخارجية ستلاحظ زيادة في حركة الزوار على متجرك الإلكتروني. 📈 4 زيادة عدد العملاء الذين يقومون بإجراء عمليات شراء من متجرك الإلكتروني. 💼 5 بناء الروابط الخارجية القوية يساهم في بناء سمعة ومصداقية إيجابية لمتجرك في أعين العملاء. 🏆 6 توفر الخدمة لك الوقت والجهد الذي يتطلبه البحث والتواصل وبناء الروابط الخارجية. ⏳ 7 يتم تنفيذ بناء الباك لينكس بطريقة تحسين تجربة المستخدم في متجرك. 🛒 8 تحسين ووضع الكلمات الرئيسية في الروابط الخارجية لجذب زوار مهتمين بمنتجاتك أو خدماتك. 🎯 لمن هذه الخدمة : 1 لكل شخص يملك متجرًا إلكترونيًا على منصة سلة ويرغب بالتفوق على المنافسين. 👥 2 لكل شخص يرغب في تصدر متجره محركات البحث وزيادة الزوار. 📈 3 لكل شخص يرغب في تصدير منتجاته محركات البحث وزيادة المبيعات. 🌍 4 لطلب خدمة ضبط Technical SEO لمتجرك الإلكتروني ملاحظات مهمة : * لا تنتظر نتائج الخدمه بعد تسليمها مباشرة ولكن أصبر فنحن ليس في يدينا عصا سحرية. * لا تزال الباك لينكس ومؤشرات السيو الخارجي الأخرى تشكل أساس خوارزميات Google. 🧙‍♂️ وقد صرحت شركة جوجل بنفسها في إحدى وثائقها أنها تعتمد بشكل مباشر على الروابط في ترتيب نتائج البحث قائلة: “How pages link to each other is one well-known signal that we use. But we use many more, which we don’t disclose to help protect the integrity of our results.” 📈 * قبل طلب خدمة السيو الخارجي، من المهم أن يكون قد تم ضبط الـ SEO الداخلي لمتجرك. لطلب السيو SEO الداخلي من هنا . * إن بناء روابط خلفية بهدف تحسين ترتيب موقعك على محركات البحث يتعلق بالجودة وليس بالكمية، لذلك في متجرنا تجد أقصى حد 200 باك لينكس لأننا نركز على الجودة. 🔗 لماذا تختار خبراء المنصات لتنفيذ هذه الخدمة؟ 1️⃣ لدينا فريق من الخبراء والمتخصصين في مجال تأسيس وتصميم المتاجر الإلكترونية، الذين يتمتعون بخبرة واسعة. 2️⃣ لدينا سمعة جيدة في تقديم خدمات عالية الجودة وتحقيق نتائج ملموسة. 3️⃣ موثوقون في منصة الأعمال. 4️⃣ نحن نضمن تقديم خدمة عالية الجودة. 5️⃣ نحن نقدر وقتك وأعمالك، ونلتزم بتقديم الخدمة وفقًا للمواعيد المحددة. سنعمل بجدية لضمان تسليم الخدمة في الوقت المناسب. 6️⃣ نحرص على توفير خدمات ذات جودة عالية. 7️⃣ نقدم مجموعة متنوعة من خيارات الدفع المرنة. الأسئلة الشائعة 1 ما هو دور السيو الخارجي في تحسين تصنيف متجري في محركات البحث؟ دور السيو الخارجي هو بناء روابط ذات جودة عالية من مواقع أخرى إلى موقعك، مما يزيد من مصداقية وشعبية موقعك في نظر محركات البحث. هذا يؤدي إلى تحسين تصنيف موقعك في نتائج البحث.📈 2 هل يمكنكم توضيح كيفية اختيار المواقع المناسبة لبناء الروابط الخارجية؟ بالطبع، نحن نقوم بدراسة موقعك ومجاله بعناية لتحديد المواقع ذات الصلة والموثوقة التي يمكن أن نبني روابط عليها. نهدف إلى الاختيار الجيد من بين مصادر ذات سمعة وارتباط بمحتواك، مما يسهم في تحسين تصنيف موقعك بشكل فعّال.🎯 3 ما هو تأثير الروابط الخارجية على سمعة موقعي؟ الروابط الخارجية تعزز سمعة موقعك من خلال تقديم إشارات إيجابية لمحركات البحث بشأن جودة محتواك وشعبيتك. كلما زادت الروابط ذات الجودة والصلة، زادت مصداقية موقعك في السوق وزادت فرص جذب الجمهور المستهدف.🌟 4 هل يمكن أن يكون بناء الروابط الخارجية غير أخلاقي؟ نعم، يمكن أن يكون بناء الروابط الخارجية غير أخلاقي إذا تم استخدام تقنيات سوداء أو انتهاكات لسياسات محركات البحث. نحن في متجر خبراء المنصات نلتزم بأفضل الممارسات والأخلاقيات في بناء الروابط.🚀 5 كم من الوقت يحتاج السيو الخارجي لتحقيق نتائج؟ تعتمد سرعة رؤية النتائج على العديد من العوامل مثل جودة الروابط ومجال التخصص ومنافسة الكلمات الرئيسية. عمومًا، يمكن أن يستغرق بناء الروابط الخارجية بضعة أشهر على الأقل لرؤية تأثير إيجابي على تصنيف موقعك.⏳ 6 ما هو الفرق بين السيو الداخلي والسيو الخارجي والتكنكل سيو؟ 1 السيو الداخلي (On-Page SEO): يرتبط بتحسين عوامل داخل موقعك على الأنترنت التي تؤثر على تصنيفه في محركات البحث. 2 السيو الخارجي (Off-Page SEO): يتعلق ببناء الروابط من مواقع أخرى إلى موقعك ، حيث تعتقد محركات البحث أن المواقع التي تحصل على الروابط من مصادر موثوقة تقدم محتوى ذو قيمة وتزيد تصدره. 3 التكنكل سيو (Technical SEO): يتمحور حول الجوانب التقنية لموقع الويب التي تؤثر على تصنيفه ورؤيته من قبل محركات البحث. 7 هل تقدمون تقارير حول الروابط التي تم بناؤها وأثرها على موقعي؟ نعم، نقدم تقارير شاملة تحتوي على معلومات حول الروابط التي تم بناؤها، مصادرها، وجودتها. كما نوفر تحليلًا دوريًا لقياس تأثير هذه الروابط على تصنيف موقعك في محركات البحث وحركة المرور و رفع جودة الدومين DA و جودة الصفحات والأقسام PA. أطلب خدمة تحسين السيو الخارجي واجعل متجرك يتصدر نتائج محركات البحث ودعنا نساعدك في بناء سمعة قوية، وجذب المزيد من العملاء، وزيادة المبيعات. لا تضيع الفرصة، اطلب الخدمة واحصل على تحسينات فعّالة للسيو الخارجي لمتجرك 📊📢."
228198946,تقييم وتحليل متجرك الإلكتروني,service,sale,99,99,SAR,اكاديمية خبراء المنصات,https://salatips.com/ar/تقييم-وتحليل-متجرك-الإلكتروني/p228198946,64,5,خيارات دفع محدودة / لا يوجد تقسيط | ضعف التسويق وإدارة حسابات التواصل الاجتماعي | ضعف خدمة العملاء والتواصل المباشر | الحاجة لتقييم/تحليل شامل للمتجر | نقص المعرفة/المهارة في إدارة المتجر,🔍 خدمة تقييم وتحليل متجرك الإلكتروني تهدف إلى توفير تقييم شامل وتحليل دقيق لمتجرك الإلكتروني.سوف نقوم بتقييم جوانب متعددة في متجرك وتحليل أدائه بناءً على أكثر من 50 نقطة مهمة في المتجر والعديد من المعايير والمؤشرات الهامة. ومساعدتك في تطوير وتحسين متجرك. 🚀 الخدمة تشمل ما يلي: ✅ تسليمك التقييم في ملف pdf منسق وجاهز 📄 ✅ مراجعة المتجر بشكل كامل من حيث عرض المنتجات والأسعار والتصنيفات وغيرها. ✅ تحديد نقاط القوة والضعف في متجرك & مشروعك 💪 ✅ نقوم بتحليل تجربة المستخدم في متجرك الإلكتروني 🔍. ✅ تقييم أيضًا تجربة المستخدم عبر مختلف الأجهزة والمتصفحات لضمان تجربة مرنة للمستخدمين. ✅ تقديم اقتراحات تطويرية ومميزة لمتجرك 🎯. ✅ توضيح الأخطاء في المتجر. ❌ ما هي المميزات والمنافع التي ستحصل عليها بعد شرائك الخدمة: 1️⃣ ستتمكن من الحصول على فهم مفصل وشامل لأداء متجرك الإلكتروني. 2️⃣ ستعرف بالضبط ما هي الأشياء التي تحتاج الى تحسينها لتحقيق أفضل أداء لمتجرك وتحقيق أهدافك. 3️⃣ ستتلقى تقارير مفصلة وتحليلات موجزة تساعدك في اتخاذ قرارات استراتيجية فعالة لتحسين أداء متجرك وزيادة مبيعاته. 4️⃣ ستحصل على رؤى قيمة حول نقاط القوة والضعف. 💡📈 لمن هذه الخدمة : هذه الخدمة متاحة لأي شخص أو شركة تمتلك متجرًا إلكترونيًا وترغب في تحسين أدائه ونجاحه. 🛒🏬 ملاحظة: الخدمة لا تتضمن أي تعديلات على الموقع، يتم تحليل وتقييم المتجر و ارسال التقرير بصيغة PDF بعد طلب الخدمة سيتم تحليل المتجر من خلال فريقنا المختص و سيتم إرسال لكم التقرير . خلال اقل من 3 ايام لماذا تختار خبراء المنصات لتنفيذ هذه الخدمة؟ 1️⃣ يمتلك فريقنا خبرة ومهارة في تحليل وتقييم متاجر الكترونية. يتمتعون بفهم عميق وخبرة واسعة في اعطائك تحليلات دقيقة. 2️⃣ لدينا سمعة جيدة في تقديم خدمات عالية الجودة وتحقيق نتائج ملموسة. 3️⃣ موثوقون في منصة الأعمال. 4️⃣ نحن نضمن تقديم خدمة عالية الجودة. 5️⃣ نحن نقدر وقتك وأعمالك، ونلتزم بتقديم الخدمة وفقًا للمواعيد المحددة. سنعمل بجدية لضمان تسليم الخدمة في الوقت المناسب. 6️⃣ نحرص على توفير خدمات ذات جودة عالية. 7️⃣ نقدم مجموعة متنوعة من خيارات الدفع المرنة. الأسئلة شائعة: 1️⃣ ما هو تقييم وتحليل متجر الكتروني؟ تقييم وتحليل متجر الكتروني هو عملية تقدير وفحص شامل لمتجرك على الإنترنت بهدف تحديد نقاط القوة والضعف وتحديد فرص التحسين. يشمل ذلك تقييم أداء الموقع، وتجربة المستخدم، واستراتيجيات التسويق، وتحليل البيانات، وأمور أخرى. 2️⃣ لماذا يجب عليّ تقييم وتحليل متجري الإلكتروني؟ تقييم وتحليل متجر الكتروني ضروري لتحسين أداء الأعمال عبر الإنترنت. يساعد في تحديد المشاكل والتحسينات المحتملة وزيادة مبيعاتك وجذب المزيد من العملاء. 3️⃣ كيف يمكنني الاستفادة من نتائج التقييم والتحليل؟ بعد استلام نتائج التقييم والتحليل، يمكنك تنفيذ التوصيات المقدمة لتحسين متجرك الإلكتروني، وبالتالي زيادة حركة المرور، وتحسين تحويل العملاء إلى مبيعات. 4️⃣ كيف يمكنني البدء في تقديم طلب لهذه الخدمة؟ يمكنك البدء بالتواصل معنا من خلال ملء استمارة طلب الخدمة على موقعنا الإلكتروني أو التواصل معنا عبر الواتساب، وسنقوم بتقديم مزيد من المعلومات والتفاصيل حول الخدمة. إذا كنت تبحث عن تحسين متجرك الإلكتروني وزيادة نجاحك في التجارة الإلكترونية، فلا تتردد من شراء خدمتنا لتقييم وتحليل متجرك. وجعله يجذب المزيد من العملاء والمبيعات.🚀📊
262343667,انشاء سجل تجاري,product,sale,229,,SAR,الخدمات الحكومية,https://salatips.com/ar/انشاء-سجل-تجاري/p262343667,55,5,المتجر جديد / يحتاج تأسيس كامل,هل ترغب في إنشاء سجل تجاري في المملكة العربية السعودية؟ نحن هنا لمساعدتك في تحقيق ذلك بكل سهولة ويسر. سنقوم بمساعدتكم وإرشادكم خطوة بخطوة لاكمال جميع الإجراءات اللازمة لإنشاء سجل تجاري. تفاصيل الخدمة: توفري الاستشارات اللازمة لفهم المتطلبات القانونية والإجرائية لإنشاء سجل تجاري في المملكة العربية السعودية. مساعدتك في استكمال جميع النماذج والمستندات الضرورية لتقديم طلب السجل التجاري. متابعة الإجراءات مع الجهات المعنية حىت استلام سجل التجاري النهائي. مميزات الخدمة: - توفر الوقت والجهد في فهم وإنجاز الإجراءات القانونية والإجرائية لإنشاء سجل تجاري. ضمان التقديم الصحيح والموثوق به للمستندات والنماذج اللازمة. تقديم الدعم والإرشاد طوال عملية إنشاء السجل التجاري. لمن هذه الخدمة: هذه الخدمة موجهة لأفراد السعوديين الراغبين في إنشاء سجل تجاري في المملكة العربية السعودية. سواء كنت ترغب في بدء عمل تجاري جديد أو توسيع نشاطك التجاري الحالي، فإن هذه الخدمة تلبي احتياجاتك وتضمن لك الحصول على سجل تجاري
2074667911,إضافة الوصف والكلمات الدلالية للمنتجات,service,sale,119,,SAR,تحسين وتطوير المتاجر الالكترونية,https://salatips.com/ar/إضافة-الوصف-والكلمات-الدلالية-للمنتجات/p2074667911,47,5,ضعف الظهور في محركات البحث / قلة الزيارات (SEO) | خيارات دفع محدودة / لا يوجد تقسيط | ضعف التسويق وإدارة حسابات التواصل الاجتماعي | الحاجة لتقييم/تحليل شامل للمتجر | نقص المعرفة/المهارة في إدارة المتجر,"🛍️ خدمة ""إضافة الوصف والكلمات الدلالية للمنتجات"" تقدم لك فرصة تحسين وتحسين وصف المنتجات المعروضة في متجرك الإلكتروني. 🛒 يتضمن هذه الخدمة إنشاء وتعديل وتحسين الوصف الخاص بكل منتج، بالإضافة إلى اختيار الكلمات الدلالية المناسبة 📊🔍 التي تساعد في زيادة رؤية وتواجد منتجاتك في نتائج محركات البحث. 📈🔎 الخدمة تشمل: 1️⃣ يتم تعديل وتحسين وصف المنتجات الخاصة بك، بما في ذلك إضافة تفاصيل أكثر وواضحة حول المنتجات. 2️⃣ توضيح فوائدها وميزاتها الفريدة. ستساعد هذه الخطوة في جذب انتباه العملاء وزيادة فرص البيع. 3️⃣ تتم مراجعة الكلمات الدلالية المستخدمة لوصف المنتجات وتحسينها. 4️⃣ يتم العمل على اختيار الكلمات الأكثر صلة وشيوعًا التي يبحث عنها العملاء عند البحث عن منتجات مماثلة. 5️⃣ يتم ضمان استخدام الكلمات الدلالية الصحيحة لزيادة فرص ظهور منتجاتك في نتائج محركات البحث. 6️⃣ من خلال تحسين وصف المنتجات واختيار الكلمات الدلالية المناسبة، ستزيد فرص ظهور منتجاتك في نتائج محركات البحث. 7️⃣ تحصل على رؤية أفضل وتواجد أعلى في البحث، مما يزيد من فرصة وصول العملاء المستهدفين إلى منتجاتك وزيادة مبيعاتك. 8️⃣ يتم تحسين تجربة العملاء عند التصفح والبحث عن المنتجات في متجرك. 9️⃣ يصبح الوصف الواضح والشامل واختيار الكلمات الدلالية الصحيحة مفيدًا للعملاء في فهم المنتجات واتخاذ قرارات الشراء بناءً على معلومات دقيقة. 🔟 بفضل الوصف المحسن والكلمات الدلالية الصحيحة، ستزيد فرص بيع المنتجات وتحويل الزوار إلى عملاء فعليين. لمن هذه الخدمة : لكل شخص يشتغل التجارة الإلكترونية ويمتلك متجر إلكتروني .🚀💰 ملاحظة: *يمكن تحديد عدد المنتجات من نموذج الطلب. *تأكد من وضع معلومات التواصل بشكل صحيح.🤝 * إذا كان لديك أي أسئلة أو استفسارات، فلا تتردد في التواصل مع دعمنا الفني. نحن هنا لمساعدتك والإجابة على استفساراتك بكل اهتمام واحترافية.📞 لماذا تختار خبراء المنصات لتنفيذ هذه الخدمة؟ 1️⃣ يمتلك فريقنا خبرة ومهارة في إضافة المدونة لمتجرك على منصة سلة. ويتمتعون بفهم عميق وخبرة واسعة في المدونات. 2️⃣ لدينا سمعة جيدة في تقديم خدمات عالية الجودة وتحقيق نتائج ملموسة. 3️⃣ موثوقون في منصة الأعمال. 4️⃣ نحن نضمن تقديم خدمة عالية الجودة. 5️⃣ نحن نقدر وقتك وأعمالك، ونلتزم بتقديم الخدمة وفقًا للمواعيد المحددة. سنعمل بجدية لضمان تسليم الخدمة في الوقت المناسب. 6️⃣ نحرص على توفير خدمات ذات جودة عالية. 7️⃣ نقدم مجموعة متنوعة من خيارات الدفع المرنة. الأسئلة الشائعة 1️⃣ أهمية إضافة الوصف والكلمات الدلالية للمنتجات؟ 🚀📊 إضافة وصف وكلمات دلالية جيدة للمنتجات تزيد من احتمالية ظهور المنتجات في نتائج محركات البحث عندما يبحث الناس عن منتجات مماثلة. وبالتالي، يمكن أن تزيد من حركة المرور إلى موقعك على الإنترنت وزيادة مبيعاتك. 2️⃣ كيف يمكن لخبراء المنصات مساعدتي في إضافة الوصف والكلمات الدلالية للمنتجات؟ 💼🤝 الشركة ستقوم بتعيين فريقها لكتابة المحتوى و لإنشاء وصف فعّال للمنتجات الخاصة بك. سيتم أيضًا تحليل المنتجات والبحث عن الكلمات الرئيسية التي يمكن استهدافها. بعد ذلك، سيتم دمج هذا الوصف والكلمات الدلالية في صفحات المنتج على موقعك على الإنترنت. 3️⃣ كم يستغرق إضافة الوصف والكلمات الدلالية للمنتجات؟ ⏳📅 ج5: يعتمد الوقت الذي يستغرقه هذا العمل على عدد المنتجات وتعقيداتها. غالبًا ما يمكن أن تستغرق هذه العملية بضعة أيام إلى عدة أسابيع اعتمادًا على حجم المشروع. هل ترغب في رؤية متجرك يحقق نجاحًا أكبر؟ هل ترغب في زيادة تواجد منتجاتك في محركات البحث وجذب المزيد من العملاء؟ إذا كانت الإجابة نعم، فإن خدمة إضافة الوصف والكلمات الدلالية للمنتجات هي الحل المثالي لك."
