id,name,type,status,price,sale_price,currency,category,url,sold_quantity,rating,problems_solved,description
1185206993,باقة التوثيق المتكاملة,service,sale,299,299,SAR,ربط الخدمات,https://salatips.com/ar/باقة-التوثيق-المتكاملة/p1185206993,40,5,خيارات دفع محدودة / لا يوجد تقسيط | التوثيق والمتطلبات النظامية (معروف/وثيقة عمل حر/جمارك),📦 باقة التوثيق المتكاملة تهدف باقة التوثيق المتكاملة إلى تزويد رواد الأعمال وأصحاب المتاجر الإلكترونية بحزمة شاملة من الخدمات التي تعزز المصداقية، وتوفر حماية قانونية، وتسهّل المعاملات المالية. تشمل هذه الباقة: إصدار وثيقة العمل الحر المعتمدة من وزارة الموارد البشرية والتنمية الاجتماعية. فتح حساب بنكي تجاري في مصرف الراجحي لإدارة معاملاتك المالية. 📜 أولاً: إصدار وثيقة العمل الحر مميزات الوثيقة: 💻 ممارسة التجارة الإلكترونية. 📜 التسجيل الاختياري في التأمينات الاجتماعية. 📝 التعاقد مع الجهات الحكومية والخاصة كمستند رسمي. 💳 فتح حساب بنكي مرتبط بالوثيقة واستخدام قنوات الدفع الرقمية. 🤝 تعزيز المصداقية وحماية حقوقك كعامل حر. ⚖️ استخدامها كدليل قانوني في حال النزاعات. شروط إصدار الوثيقة: 🇸🇦 سعودي الجنسية. 📅 العمر 18 عامًا هجريًا فما فوق. 💼 وجود حساب أبشر مفعل. مدة الصلاحية: سنة واحدة من تاريخ الإصدار. 🏦 ثانيًا: فتح حساب بنكي تجاري المزايا: سداد الفواتير والمدفوعات الإلكترونية بسهولة. الحصول على دفتر شيكات لإدارة المدفوعات. تحويل واستقبال الأموال من وإلى أي مكان. فصل أموال العمل عن الأموال الشخصية لزيادة الشفافية. أمان وحماية إضافية للحساب. شروط الخدمة: وجود سجل تجاري أو وثيقة عمل حر سارية المفعول. 💡 لماذا تختار خبراء المنصات؟ فريق متخصص في إصدار الوثائق، فتح الحسابات، وتوثيق المتاجر. خبرة واسعة وسمعة ممتازة في تقديم خدمات عالية الجودة. التزام تام بالمواعيد المحددة. خيارات دفع مرنة ودعم كامل حتى إتمام الخدمة. 📌 ضمان الخدمة في حال عدم الموافقة على إصدار الوثيقة أو فتح الحساب، سيتم إرجاع المبلغ كاملًا. 🚀 استثمر في نجاحك التجاري مع باقة التوثيق المتكاملة لتحصل على الحماية، المصداقية، والتنظيم المالي في خطوة واحدة فقط.
200648001,تصوير فيديوهات UGC,service,sale,459,,SAR,تصوير المنتجات و الفيديوهات,https://salatips.com/ar/تصوير-فيديوهات-ugc/p200648001,39,5,تصميم وواجهة المتجر غير احترافية / تجربة استخدام ضعيفة | ضعف التسويق وإدارة حسابات التواصل الاجتماعي | منتجات ناقصة أو أوصاف/تصوير ضعيف,تبغى تزيد من التفاعل مع إعلانات متجرك ومنتجاتك؟ دعنا نساعدك في ذلك من خلال توفير خدمة تصوير مقاطع فيديو UGC القصيرة والاحترافية، مع تعليق صوتي يضيف لمسة مميزة لإعلاناتك ويزيد من جاذبيتها. لماذا فيديوهات UGC؟ زيادة الثقة والمصداقية : يثق العملاء بالتجارب الشخصية، وبالتالي فإن فيديوهات UGC تعزز الثقة في منتجاتك وعلامتك التجارية. توليد محتوى تفاعلي: يستجيب المستهلكون بشكل أفضل للمحتوى الذي يتم إنشاؤه من قبل افراد، وهو ما يزيد من فاعلية الفيديوهات ويجعلها تلفت الانتباه بشكل أكبر. تكلفة منخفضة وجودة عالية: بالمقارنة مع الإعلانات التقليدية، توفر فيديوهات UGC جودة عالية مع تكلفة منخفضة، مما يجعلها اختيارًا مثاليًا لتعزيز حملاتك الإعلانية بأقل تكلفة ممكنة. زيادة التفاعل والمشاركة : يشجع المحتوى الذي يعتمد على تجارب الأفراد على التفاعل والمشاركة بشكل أكبر، مما يعزز رواج وشهرة منتجاتك بين العملاء المحتملين. مميزات خدمتنا: تصميم وإنتاج احترافي: نوفر تصميمًا وإنتاجًا احترافيًا لمقاطع الفيديو الخاصة بك، مما يضمن جودة عالية وجاذبية متميزة لإعلاناتك. تعليق صوتي مخصص : نقدم خدمة تعليق صوتي مخصص يناسب أسلوبك ورسالتك التسويقية، سواء كان ذلك صوت نسائي أو رجالي. ضمان الجودة: نحرص على الدقة والاهتمام بأدق التفاصيل في كل مرحلة من مراحل تصميم وإنتاج الفيديو. خدمة سريعة: نقدم خدمة سريعة وفعالة، حيث يمكننا تسليم مقاطع الفيديو خلال فترة قصيرة تتراوح بين 3 إلى 7 أيام عمل. ملاحظة : مدة الفيديوهات: لا تزيد عن 45 ثانية. يتم ارسال المنتجات من قبلكم اختر خدمتنا الآن لزيادة تفاعل الجمهور مع منتجاتك وتحقيق نجاح أفضل
477661895,ربط وإضافة البيكسل لمتجرك الالكتروني,service,sale,0,,SAR,ربط الخدمات,https://salatips.com/ar/إضافة-سناب-شات-بيكسل-لمتجرك-الإلكتروني/p477661895,38,5,خيارات دفع محدودة / لا يوجد تقسيط | لا يوجد تتبع/تحليلات للزوار والأداء | ضعف التسويق وإدارة حسابات التواصل الاجتماعي | الحاجة لتقييم/تحليل شامل للمتجر,👾📊 خدمة إضافة سناب بيكسل لمتجرك الإلكتروني تهدف إلى تحسين استراتيجية التسويق وتتبع الأداء على منصة سناب شات. سناب بيكسل هو عبارة عن كود برمجي يمكنك إدراجه في صفحات موقعك الإلكتروني لجمع بيانات المستخدمين وتتبع الأنشطة والتفاعلات التي يقومون بها على موقعك. 🖥️ الخدمة تشمل : 1️⃣ باستخدام سناب بيكسل، يمكنك إنشاء جمهور مخصص واستهدافه بناءً على البيانات التي تم جمعها من زوار موقعك. 👥 2️⃣ يمكنك استهداف العملاء المحتملين الذين أظهروا اهتمامًا بمنتجاتك أو خدماتك وتوجيه إعلانات مستهدفة لهم على منصة سناب شات. 🎯 3️⃣ باستخدام سناب بيكسل، يمكنك تحسين استهداف إعلاناتك لتصل إلى الجمهور المناسب. 📈 4️⃣ يمكن للبيكسل تتبع الأنشطة التي يقوم بها الزوار على موقعك، مثل إضافة منتج إلى سلة التسوق أو إتمام عملية الشراء، ويمكن استخدام هذه المعلومات لتوجيه الإعلانات بشكل أفضل للعملاء المحتملين. 📊 5️⃣ يساعد سناب بيكسل في تتبع وتحليل أداء حملات التسويق الخاصة بك على منصة فيسبوك. 📊 6️⃣ يمكنك رؤية التفاعلات والمبيعات التي تم توليدها على موقعك بفضل حملات الإعلان على فيسبوك. 💻 7️⃣ يساعدك سناب بيكسل في تقييم فعالية استراتيجياتك واتخاذ قرارات مستنيرة. 🧐 ما هي المميزات والمنافع التي ستحصل عليها بعد شرائك الخدمة 1️⃣ تتمكن من إنشاء جمهور مخصص واستهدافه على منصة سناب شات بناءً على البيانات التي تم جمعها من زوار موقعك. 🎯 2️⃣ تتمكن من توجيه الإعلانات للعملاء المحتملين الذين أبدوا اهتمامًا بمنتجاتك أو خدماتك، مما يساعد في زيادة فرص التحويل وزيادة المبيعات. 📈 3️⃣ تتمكن من تحسين استهداف إعلاناتك على فيسبوك بناءً على الأنشطة التي يقوم بها الزوار على موقعك. 📊 4️⃣ من خلال معرفة سلوك العملاء واهتماماتهم، يمكنك تحسين تجربتهم على موقعك. 🌐 5️⃣ تتمكن من تتبع وتحليل أداء حملاتك الإعلانية على سناب شات بدقة عالية. 📈 6️⃣ تحصل على بيانات حول عدد الزوار، والتفاعلات، والمبيعات التي تم توليدها على موقعك من خلال الإعلانات على سناب شات. 📊 مدة انجاز الخدمة: من 24- 48 ساعة لماذا تختار خبراء المنصات لتنفيذ هذه الخدمة؟ 1️⃣ يمتلك فريقنا خبرة ومهارة في إضافة سناب بيكسل لمتجرك الإلكتروني. ويتمتعون بفهم عميق وخبرة واسعة في سناب شات بيكسل. 2️⃣ لدينا سمعة جيدة في تقديم خدمات عالية الجودة وتحقيق نتائج ملموسة. 3️⃣ موثوقون في منصة الأعمال. 4️⃣ نحن نضمن تقديم خدمة عالية الجودة. 5️⃣ نحن نقدر وقتك وأعمالك، ونلتزم بتقديم الخدمة وفقًا للمواعيد المحددة. سنعمل بجدية لضمان تسليم الخدمة في الوقت المناسب. 6️⃣ نحرص على توفير خدمات ذات جودة عالية. 7️⃣ نقدم مجموعة متنوعة من خيارات الدفع المرنة. الأسئلة الشائعة 1️⃣ ما هي خدمة سناب شات بيكسل؟ خدمة سناب شات بيكسل هي أداة تحليل تقدمها منصة سناب شات تسمح للمعلنين بقياس أداء حملات الإعلان على سناب شات وتحليل البيانات المرتبطة بها. 2️⃣ ما البيانات التي يمكنني تتبعها باستخدام سناب شات بيكسل؟ يمكنك تتبع مجموعة متنوعة من الأنشطة مثل عدد الزيارات إلى موقعك الإلكتروني، وعدد الصفحات التي تمت مشاهدتها، والمشتريات، والإشارات إلى سلة التسوق، والمزيد. 3️⃣ هل هناك تكلفة لاستخدام سناب شات بيكسل؟ يمكنك استخدام سناب شات بيكسل بشكل مجاني. 4️⃣ هل يمكنني قياس عائد الاستثمار (ROI) باستخدام سناب شات بيكسل؟ نعم، يمكنك قياس عائد الاستثمار باستخدام سناب شات بيكسل من خلال تتبع المبيعات والإيرادات المرتبطة بحملات الإعلان على سناب شات. لا تفوت فرصة ربط البيكسل في متجرك و تحسين استراتيجية التسويق على سناب شات وزيادة نجاح متجرك الإلكتروني. اطلب الخدمة الآن🚀📈
1372134745,تصميم وتطوير كامل متجرك ب Custom CSS,service,sale,999,999,SAR,تحسين وتطوير المتاجر الالكترونية,https://salatips.com/ar/تصميم-وتطوير-كامل-متجرك-بـ-custom-css/p1372134745,37,5,تصميم وواجهة المتجر غير احترافية / تجربة استخدام ضعيفة | ضعف الظهور في محركات البحث / قلة الزيارات (SEO) | عدم وجود دومين/نطاق خاص بالمتجر | خيارات دفع محدودة / لا يوجد تقسيط | ضعف التسويق وإدارة حسابات التواصل الاجتماعي | المتجر جديد / يحتاج تأسيس كامل,إذا كنت تبحث عن متجر إلكتروني بتصميم مختلف تمامًا عن القوالب التقليدية، فخدمة تطوير المتجر باستخدام Custom CSS تمنحك حرية تخصيص كاملة لإنشاء متجر احترافي يعكس هوية علامتك التجارية بدقة ويمنح عملاءك تجربة استخدام استثنائية 🚀🎨 هذه الخدمة مخصصة للمتاجر التي ترغب في الوصول إلى مستوى أعلى من الاحترافية، من خلال تطوير واجهة المتجر وتحسين تجربة المستخدم وتخصيص جميع التفاصيل البصرية بما يتناسب مع رؤية النشاط التجاري. ماذا تشمل الخدمة؟ 🎯 دراسة المتجر وفهم احتياجات المشروع 🔹 جلسة استشارية لفهم أهداف متجرك ومتطلبات نشاطك 🔹 دراسة الهوية التجارية وطبيعة المنتجات والجمهور المستهدف 🔹 وضع تصور مناسب لتطوير شكل وتجربة المتجر 🎨 تصميم واجهة المتجر بالكامل 🔹 تصميم واجهة متجر احترافية باستخدام Custom CSS 🔹 تخصيص التصميم ليتوافق مع هوية العلامة التجارية 🔹 تطوير تجربة بصرية احترافية تميزك عن المنافسين 🔹 تحسين الشكل العام للمتجر بطريقة أكثر جاذبية وتنظيمًا 💻 تطوير صفحات المتجر بالكامل تشمل عملية التطوير: 🔹 الصفحة الرئيسية 🔹 صفحات المنتجات 🔹 صفحة السلة 🔹 صفحة الدفع 🔹 الصفحات التعريفية والمحتوى 🔹 الصفحات الإضافية حسب احتياج المتجر ✨ تخصيص كامل للمظهر والتصميم يشمل التخصيص: 🔹 تعديل الألوان والخلفيات 🔹 تطوير الخطوط والعناصر البصرية 🔹 تحسين الأزرار والقوائم 🔹 تعديل التخطيطات وترتيب العناصر 🔹 تحسين عرض المنتجات والأقسام 🔹 تطوير تجربة التصفح والتنقل داخل المتجر 🔹 تحسين التجاوب مع الجوال والأجهزة المختلفة ⚙️ تطوير الوظائف وتجربة المستخدم 🔹 تحسين تجربة المستخدم داخل المتجر 🔹 تطوير واجهة أكثر سهولة ووضوحًا للعملاء 🔹 تحسين سرعة الاستخدام والتنقل 🔹 تطوير تجربة شراء أكثر احترافية وسلاسة 🔹 الاهتمام بالأداء العام للمتجر وتحسين الكفاءة المميزات التي ستحصل عليها بعد تنفيذ الخدمة ✅ متجر بتصميم فريد يعكس هوية علامتك التجارية ✅ تجربة استخدام احترافية تساعد على رفع رضا العملاء ✅ تصميم أكثر جاذبية وتميزًا عن المنافسين ✅ تحسين طريقة عرض المنتجات والمحتوى ✅ تطوير تجربة الشراء والتنقل داخل المتجر ✅ تحسين الأداء وسرعة الاستخدام ✅ توافق ممتاز مع الجوال والأجهزة المختلفة ✅ واجهة احترافية تساعد على تعزيز الثقة وزيادة فرص التحويل والمبيعات 🎁 هدية مجانية مع الخدمة 🎁 تصميم 3 بنرات احترافية مجانًا لمتجرك الإلكتروني لمن هذه الخدمة؟ ✅ لأصحاب المتاجر الباحثين عن تصميم احترافي متقدم ✅ للمتاجر التي تريد التميز عن القوالب التقليدية ✅ لمن يرغب في تخصيص كامل للواجهة والتجربة البصرية ✅ للعلامات التجارية التي تهتم بالهوية والتفاصيل الاحترافية ✅ لمن يريد رفع جودة تجربة العميل داخل المتجر ملاحظات مهمة 🔹 يشترط توفر باقة سلة برو لطلب الخدمة 🔹 يشترط توفر دومين خاص بالمتجر 🔹 ميزة Custom CSS تتطلب دعم المنصة لهذه الخاصية 🔹 بعد تأكيد الطلب سيتم دراسة متطلبات المشروع بشكل كامل قبل بدء التنفيذ 🔹 تأكد من إدخال معلومات التواصل بشكل صحيح 🔹 الدعم الفني متوفر للإجابة على الاستفسارات المتعلقة بالخدمة الأسئلة الشائعة ما المقصود بتطوير متجر باستخدام Custom CSS؟ هو تخصيص واجهة المتجر برمجيًا باستخدام CSS لإعطاء المتجر شكلًا مختلفًا وأكثر احترافية يتوافق مع هوية النشاط التجاري. ما الفائدة من تصميم متجر بـ Custom CSS؟ يساعدك على الحصول على تصميم فريد، وتحسين تجربة المستخدم، وتخصيص كامل للمظهر بدل الاعتماد على التصميم التقليدي. هل يمكن تحديث المتجر لاحقًا؟ نعم، يمكن تطوير وتعديل المتجر مستقبلًا حسب احتياجات النشاط. ماذا يشمل التخصيص داخل الخدمة؟ يشمل الألوان والخلفيات والخطوط والعناصر البصرية والتخطيطات وتحسين الصفحات وتجربة المستخدم داخل المتجر. هل المتجر سيكون متوافقًا مع الجوال؟ نعم، يتم الاهتمام بتحسين التجاوب مع الجوال والأجهزة المختلفة لضمان أفضل تجربة استخدام. 🛍️ خدمة تصميم وتطوير المتجر بـ Custom CSS تمنحك مستوى جديد من الاحترافية والتخصيص، وتساعدك على بناء متجر مميز يعكس هوية علامتك التجارية ويمنح عملاءك تجربة تسوق قوية ومختلفة 🚀✨
1701559184,تصميم شعار احترافي,service,sale,999,999,SAR,التصميم الجرافيكي,https://salatips.com/ar/تصميم-شعار-لمتجرك-الإلكتروني/p1701559184,34,0,تصميم وواجهة المتجر غير احترافية / تجربة استخدام ضعيفة | ضعف الظهور في محركات البحث / قلة الزيارات (SEO) | لا يوجد تتبع/تحليلات للزوار والأداء | ضعف التسويق وإدارة حسابات التواصل الاجتماعي,"خدمة تصميم شعار احترافي يهدف إلى توفير شعار مميز وفريد يعكس هوية متجرك ويساعد في بناء الهوية التجارية القوية والتميز عن المنافسين. 💼✨ الخدمة تشمل ما يلي: 🎨 تصميم 3 نماذج للشعار. 📁 تقديم الملفات النهائية للشعار بصيغ متعددة وعالية الجودة (PDF , PNG , JPEG ). 💼 تزويدك بملف المصدر للشعار. 🔮 يتم تصميم الشعار خصيصًا لمتجرك الإلكتروني، مع مراعاة أهدافك ورؤيتك الفريدة. ما هي المميزات والمنافع التي ستحصل عليها بعد شرائك الخدمة 1️⃣ يساعد الشعار المميز في بناء هوية متجرك وجعله متميزًا وقابلاً للتعرف. 2️⃣ سيعكس الشعار رسالة متجرك وقيمته الأساسية. 3️⃣ تحصل على شعار مميز وفريد يعكس هوية متجرك ويميزه عن المنافسين. 4️⃣ توفير تصميم عالي الجودة يعكس احترافيتك ومصداقية متجرك. 5️⃣ سيساعد الشعار على إيصال رسالة واضحة وقوية عن متجرك. 6️⃣ ستحصل على ملفات الشعار بصيغ مختلفة وقابلة للاستخدام على مختلف المنصات. 7️⃣ يصمم الشعار فريق من المصممين المحترفين الذين يتمتعون بالخبرة والمهارة. لمن هذه الخدمة : لكل من يمتلك متجر إلكتروني ويرغب بــــــشعار مميز و إ حترافي للتميز عن المنافسين. للمزيد من الخدمات تصميم فيديو اعلاني احترافي الأسئلة الشائعة ؟ 1️⃣ ما هو دور الشعار في متجري الإلكتروني؟ الشعار هو عبارة عن رمز بصري يمثل هويتك وعلامتك التجارية. إنه يساعد في تمييز متجرك عن الآخرين ويخلق تعرفاً فورياً بين الجمهور ومنتجاتك أو خدماتك. 2️⃣ ما هي الخطوات التي تتبعها لتصميم الشعار؟ نقوم أولاً بفهم متطلباتك ورؤيتك لتصميم الشعار. ثم نقوم بإجراء أبحاث للتعرف على هويتك وجمهورك المستهدف. بعد ذلك، نبدأ في تطوير الأفكار وتصميم الرسومات واختيار الألوان المناسبة. نعمل بالتعاون معك لتعديل التصميم حسب رغبتك حتى نصل إلى الشعار النهائي. 3️⃣ هل يمكن تضمين عناصر خاصة بمتجري في تصميم الشعار؟ نعم، يمكننا تضمين عناصر مميزة تمثل منتجاتك أو خدماتك في تصميم الشعار، وذلك ليعكس بشكل دقيق ما تقدمه. 4️⃣ ماذا يميز تصميم الشعار لدى خبراء المنصات؟ نحن نقوم بتقديم تصميم مخصص وفريد يتماشى مع رؤيتك وقيم علامتك التجارية. نهتم بتفاصيل كل جزء في الشعار ونضمن تميزه وسهولة تعرفه. 5️⃣ هل يمكنني استخدام الشعار على جميع وسائل التواصل؟ نعم، يمكنك استخدام الشعار على جميع وسائل التواصل الاجتماعي، وعلى موقعك الإلكتروني، وفي المطبوعات، والمزيد. مدة التنفيذ: من 7 إلى 14 يوم أشتري الآن خدمة تصميم شعار فريد لمتجرك الإلكتروني 💼✨ يميزك عن المنافسين ويساعدك في بناء هويتك التجارية المميزة والتفوق في سوق المتاجر الإلكترونية. نحن هنا لمساعدتك في تحقيق رؤيتك ونجاح متجرك الإلكتروني. 🚀🌟"
