id,name,type,status,price,sale_price,currency,category,url,sold_quantity,rating,problems_solved,description
1715095652,اصدار شهادة الأجر الخاضع للاشتراك,service,hidden,56.35,,SAR,,https://salatips.com/ar/اصدار-شهادة-الأجر-الخاضع-للاشتراك/p1715095652,0,0,خيارات دفع محدودة / لا يوجد تقسيط | التوثيق والمتطلبات النظامية (معروف/وثيقة عمل حر/جمارك),خدمة إصدار شهادة الأجر الخاضع للاشتراك تهدف إلى توفير مستند رسمي يوضح الأجر الشهري الذي يخضع للاشتراك في نظام التأمينات الاجتماعية للعاملين. تُستخدم هذه الشهادة لأغراض عديدة مثل إثبات الدخل، وتقديم طلبات القروض، والتحقق من الأجور لأغراض قانونية وإدارية. 📋🏦 متطلبات الخدمة: 1️⃣ تقديم بيانات الموظف الأساسية مثل الاسم، رقم الهوية، وتاريخ التوظيف. 2️⃣ تحديد الأجر الشهري الخاضع للاشتراك بشكل دقيق. 3️⃣ الحصول على تصديق من الجهة المسؤولة داخل المؤسسة أو الشركة. ما هي المميزات والمنافع التي ستحصل عليها بعد شرائك الخدمة: 1️⃣ توثيق رسمي: الشهادة توفر توثيقًا رسميًا للأجر الشهري الخاضع للاشتراك، مما يسهل التعامل مع الجهات الحكومية والخاصة. 2️⃣ زيادة المصداقية: امتلاك شهادة موثقة يعزز من مصداقية المؤسسة والموظف أمام الجهات المختلفة. 3️⃣ سهولة الإجراءات المالية: الشهادة تسهل العديد من الإجراءات المالية مثل طلبات القروض والإجراءات البنكية. 4️⃣ تحسين التخطيط المالي: توفر الشهادة معلومات دقيقة يمكن الاعتماد عليها في التخطيط المالي وإدارة الميزانيات. 5️⃣ توفير الوقت والجهد: الخدمة توفر الوقت والجهد المبذولين في جمع وتوثيق المعلومات بشكل يدوي. لماذا تختار خبراء المنصات لتنفيذ هذه الخدمة؟ 1️⃣ يمتلك فريقنا خبرة ومهارة في إصدار شهادات الأجر الخاضع للاشتراك. 2️⃣ لدينا سمعة جيدة في تقديم خدمات عالية الجودة. 3️⃣ نضمن تقديم خدمة سريعة وفعالة. 4️⃣ نلتزم بالمواعيد ونعمل بجدية على تسليم الخدمة في الوقت المناسب. 5️⃣ نحرص على توفير خدمات ذات جودة عالية. 6️⃣ نقدم مجموعة متنوعة من خيارات الدفع المرنة. 📌 نحن هنا لمساعدتك في إصدار شهادة الأجر الخاضع للاشتراك للعاملين في مؤسستك، ونضمن تقديم خدمة عالية الجودة. ضمان الخدمة: سيتم ارجاع كامل المبلغ في حال عدم اكتمال إصدار الشهادة. 🚀💼 استفد من الفرص واستثمر في توثيق الأجر الخاضع للاشتراك لموظفيك! طلب خدمة إصدار الشهادة الآن واستفد من المزايا التي ستمنحها لمؤسستك. سنكون هنا لدعمك في تحقيق أهدافك الإدارية والمالية. 🌟🛠📈
1743510831,اصدار شهادة مدد واجور,service,hidden,171.35,,SAR,,https://salatips.com/ar/اصدار-شهادة-مدد-واجور/p1743510831,0,0,خيارات دفع محدودة / لا يوجد تقسيط | التوثيق والمتطلبات النظامية (معروف/وثيقة عمل حر/جمارك),خدمة إصدار شهادة مدد وأجور تهدف إلى تيسير عملية توثيق مدد الخدمة والأجور للعاملين في المؤسسات والشركات. توفر هذه الشهادة سجلاً موثقًا للفترات التي قضاها الموظفون في العمل والأجور التي تقاضوها، مما يسهل الإجراءات الإدارية والمالية. 📋🏦 متطلبات الخدمة: 1️⃣ توفير بيانات الموظفين الأساسية مثل الاسم، رقم الهوية، وتاريخ التوظيف. 2️⃣ تقديم تفاصيل دقيقة عن الأجور الشهرية والزيادات والمكافآت. 3️⃣ الحصول على تصديق من الجهات المعنية بالمؤسسة أو الشركة. ما هي المميزات والمنافع التي ستحصل عليها بعد شرائك الخدمة: 1️⃣ تسهيل الإجراءات الإدارية: بفضل الشهادة، سيكون لديك مرجع موثق لجميع مدد وأجور الموظفين، مما يسهل التعامل مع الإجراءات الإدارية. 2️⃣ زيادة الشفافية: الشهادة تعزز من الشفافية داخل المؤسسة، مما يزيد من ثقة الموظفين والمستفيدين. 3️⃣ تحسين التخطيط المالي: توفر الشهادة سجلاً مفصلاً يمكن الاعتماد عليه في التخطيط المالي وإدارة الميزانيات. 4️⃣ تعزيز المصداقية: امتلاك شهادة موثقة يزيد من مصداقية المؤسسة ويعكس التزامها بالمعايير والقوانين. 5️⃣ توفير الوقت والجهد: الخدمة توفر الكثير من الوقت والجهد المبذولين في توثيق المعلومات بشكل يدوي. لماذا تختار خبراء المنصات لتنفيذ هذه الخدمة؟ 1️⃣ يمتلك فريقنا خبرة ومهارة في إصدار شهادات مدد وأجور. 2️⃣ لدينا سمعة جيدة في تقديم خدمات عالية الجودة. 3️⃣ نضمن تقديم خدمة سريعة وفعالة. 4️⃣ نلتزم بالمواعيد ونعمل بجدية على تسليم الخدمة في الوقت المناسب. 5️⃣ نحرص على توفير خدمات ذات جودة عالية. 6️⃣ نقدم مجموعة متنوعة من خيارات الدفع المرنة. 📌 نحن هنا لمساعدتك في إصدار شهادة مدد وأجور للعاملين في مؤسستك، ونضمن تقديم خدمة عالية الجودة. ضمان الخدمة: سيتم ارجاع كامل المبلغ في حال عدم اكتمال إصدار الشهادة. 🚀💼 استفد من الفرص واستثمر في توثيق مدد وأجور موظفيك! طلب خدمة إصدار الشهادة الآن واستفد من المزايا التي ستمنحها لمؤسستك. سنكون هنا لدعمك في تحقيق أهدافك الإدارية والمالية. 🌟🛠📈
863055263,اصدر وثيقة الوساطة العقارية,service,hidden,113.85,,SAR,,https://salatips.com/ar/اصدر-وثيقة-الوساطة-العقارية/p863055263,0,0,ضعف الظهور في محركات البحث / قلة الزيارات (SEO) | خيارات دفع محدودة / لا يوجد تقسيط | الحاجة لتقييم/تحليل شامل للمتجر | التوثيق والمتطلبات النظامية (معروف/وثيقة عمل حر/جمارك),خدمة إصدار وثيقة الوساطة العقارية خدمة إصدار وثيقة الوساطة العقارية تهدف إلى توثيق وتنظيم أنشطة الوسطاء العقاريين وفقًا للقوانين واللوائح المعتمدة في المملكة العربية السعودية. هذه الوثيقة تعزز من ثقة العملاء في خدمات الوساطة العقارية وتضمن التزام الوسطاء بمعايير مهنية عالية. 🏢📜 متطلبات الخدمة: يلزم تقديم كافة المتطلبات أدناه بعد طلب الخدمة ليتمكن مزود الخدمة من بدء التنفيذ: السجل التجاري : تقديم نسخة من السجل التجاري للوسيط العقاري، الذي يثبت أن الوسيط مرخص له بالعمل في هذا المجال. شهادة التسجيل الضريبي : تقديم شهادة تثبت تسجيل الوسيط العقاري في ضريبة القيمة المضافة إذا كانت إيراداته تتجاوز الحد الأدنى المعفى من الضريبة. عقد الإيجار أو ملكية المكتب : تقديم عقد إيجار ساري أو سند ملكية يثبت أن للوسيط مقرًا لممارسة نشاطه. تقرير مالي : تقديم تقرير مالي حديث يوضح الوضع المالي للوسيط العقاري. بيانات التواصل : توفير كافة بيانات التواصل الخاصة بالوسيط العقاري، مثل رقم الهاتف والبريد الإلكتروني. مستندات إثبات الهوية : تقديم نسخ من الهوية الوطنية للوسيط أو الممثل القانوني للشركة. مميزات الوثيقة: توثيق رسمي : يضمن أن جميع الأنشطة العقارية تتم وفقًا للقوانين واللوائح المعتمدة، مما يعزز من شرعية الوسيط العقاري. تعزيز الثقة : يزيد من ثقة العملاء والمستثمرين في خدمات الوساطة العقارية المقدمة. تنظيم الأنشطة : يسهل تنظيم ومراقبة أنشطة الوسطاء العقاريين، مما يضمن التزامهم بالمعايير المهنية والأخلاقية. لماذا تختار خبراء المنصات لتنفيذ هذه الخدمة؟ خبرة واسعة : يمتلك فريقنا خبرة طويلة في إصدار وثائق الوساطة العقارية ودعم الوسطاء في الامتثال للمتطلبات القانونية. سمعة ممتازة : نحن معروفون بتقديم خدمات عالية الجودة ونتائج متميزة. موثوقية : نلتزم بأعلى معايير الجودة ونضمن لك تجربة سلسة وفعالة. التزام بالمواعيد : نحرص على تقديم الخدمة في الوقت المناسب، مما يعزز من رضاك وثقتك في خدماتنا. جودة لا مثيل لها : نحرص على توفير خدمات ذات جودة عالية تفوق توقعاتك. خيارات دفع مرنة : نقدم مجموعة متنوعة من خيارات الدفع التي تناسب جميع الأوضاع المالية. 📌 ملاحظات: نحن هنا لمساعدتك في إصدار وثيقة الوساطة العقارية ونضمن تقديم خدمة عالية الجودة تعزز من مصداقية عملك. 🚀💼 استفد من الفرص واستثمر في نجاح عملك العقاري! طلب خدمة إصدار وثيقة الوساطة العقارية الآن واستفد من المصداقية والثقة التي ستمنحها لعملائك. سنكون هنا لدعمك في تحقيق أهدافك العقارية والتفوق على المنافسين. 🌟🏘️📈
824357538,اصدار شهادة وافي,service,hidden,113.85,,SAR,,https://salatips.com/ar/اصدار-شهادة-وافي/p824357538,0,0,ضعف الظهور في محركات البحث / قلة الزيارات (SEO) | خيارات دفع محدودة / لا يوجد تقسيط | ضعف التسويق وإدارة حسابات التواصل الاجتماعي | الحاجة لتقييم/تحليل شامل للمتجر | التوثيق والمتطلبات النظامية (معروف/وثيقة عمل حر/جمارك),خدمة إصدار شهادة وافي تقدم خدمة إصدار شهادة وافي لتسهيل عملية الحصول على رخص التسويق والعرض لمشاريع البيع على الخارطة داخل المملكة وخارجها. تمكن هذه الخدمة المطورين والمسوقين العقاريين من طلب الرخص عبر منصة موحدة دون الحاجة لمراجعة فروع وزارة الإسكان، مما يوفر الوقت والجهد ويسهل الإجراءات. 🏢📜 المستفيدين من الشهادة: المواطنين والمواطنات متطلبات الشهادة: تقديم اتفاقية فتح حساب ضمان مع أحد البنوك المرخصة : يجب فتح حساب ضمان مع بنك مرخص، ولا يتم تفعيل هذا الحساب إلا بعد الحصول على الترخيص. وجود سجل تجاري للنشاط العقاري أو التطوير العقاري : يجب أن يكون النشاط العقاري من ضمن نشاطات السجل التجاري المراد اختياره. في حالة وجود شريك أجنبي أو الترخيص للجمعيات التعاونية : يجب أن يكون الترخيص ساري المفعول ويشمل نشاط التطوير العقاري. مميزات الشهادة: عقد بيع على الخارطة إلكترونيا : إصدار عقود البيع بشكل إلكتروني يسهّل الإجراءات ويوفر الوقت. تهميش صك الأرض إلكترونيا : يتم تهميش صك الأرض من جهة وزارة العدل لصالح وزارة الإسكان بشكل إلكتروني. إصدار وطباعة عقود الشراء إلكترونيا : إمكانية إصدار وطباعة عقود الشراء مع تحديد خطة الدفعات المناسبة بين المطور العقاري والمشتري. متابعة مراحل سير العمل في المشروع إلكترونيا : تمكين متابعة كافة مراحل سير العمل في المشروع بشكل إلكتروني لضمان الشفافية والوضوح. لماذا تختار خبراء المنصات لتنفيذ هذه الخدمة؟ خبرة واسعة : يمتلك فريقنا خبرة طويلة في إصدار شهادات وافي ودعم المشاريع العقارية. سمعة ممتازة : نحن معروفون بتقديم خدمات عالية الجودة ونتائج متميزة. موثوقية : نلتزم بأعلى معايير الجودة ونضمن لك تجربة سلسة وفعالة. التزام بالمواعيد : نحرص على تقديم الخدمة في الوقت المناسب، مما يعزز من رضاك وثقتك في خدماتنا. جودة لا مثيل لها : نحرص على توفير خدمات ذات جودة عالية تفوق توقعاتك. خيارات دفع مرنة : نقدم مجموعة متنوعة من خيارات الدفع التي تناسب جميع الأوضاع المالية. 📌 ملاحظات: نحن هنا لمساعدتك في إصدار شهادة وافي لمشروعك، ونضمن تقديم خدمة عالية الجودة تعزز من مصداقية مشروعك. 🚀💼 استفد من الفرص واستثمر في نجاح مشروعك العقاري! طلب خدمة إصدار شهادة وافي الآن واستفد من المصداقية والثقة التي ستمنحها لمشروعك. سنكون هنا لدعمك في تحقيق أهدافك العقارية والتفوق على المنافسين. 🌟🏘️📈
154870302,نقل متجر إلكتروني,service,hidden,0,,SAR,باقات صناعة المحتوى وادارة حسابات,https://salatips.com/ar/نقل-متجر-إلكتروني/p154870302,0,,ضعف التسويق وإدارة حسابات التواصل الاجتماعي | منتجات ناقصة أو أوصاف/تصوير ضعيف,خدمة نقل متجر إلكتروني (بدون وصف تفصيلي).
921091594,ربط Google Analytics,service,hidden,0,,SAR,باقات صناعة المحتوى وادارة حسابات,https://salatips.com/ar/ربط-google-analytics/p921091594,0,,لا يوجد تتبع/تحليلات للزوار والأداء | ضعف التسويق وإدارة حسابات التواصل الاجتماعي,ربط أداة قوقل أنالتكس المجانية لمعرفة عدد الزوار ومصادرهم وسلوكهم وفئتهم العمرية وموقعهم الجغرافي، وأكثر الصفحات والكلمات المفتاحية، لدعم القرارات التسويقية.
1244698369,ربط خدمات المحادثة,service,hidden,0,,SAR,باقات صناعة المحتوى وادارة حسابات,https://salatips.com/ar/ربط-خدمات-المحادثة/p1244698369,0,,ضعف التسويق وإدارة حسابات التواصل الاجتماعي | ضعف خدمة العملاء والتواصل المباشر,ربط متجرك مع مزود خدمة محادثة (متاحة في باقة بلس وبرو بمنصة سلة).
1935232488,كتيب التصميم,digital,hidden,0,,SAR,اكاديمية خبراء المنصات,https://salatips.com/ar/كتيب-التصميم/p1935232488,0,,تصميم وواجهة المتجر غير احترافية / تجربة استخدام ضعيفة | نقص المعرفة/المهارة في إدارة المتجر,كتيب رقمي مجاني عن التصميم.
1763394560,كتيب شركات الشحن,digital,hidden,0,,SAR,اكاديمية خبراء المنصات,https://salatips.com/ar/كتيب-شركات-الشحن/p1763394560,0,,مشاكل أو نقص في إعداد الشحن والتوصيل | نقص المعرفة/المهارة في إدارة المتجر,كتيب رقمي مجاني عن شركات الشحن.
1198146733,تعلم التسويق الذكي,digital,hidden,0,,SAR,اكاديمية خبراء المنصات,https://salatips.com/ar/تعلم-التسويق-الذكي/p1198146733,0,,ضعف التسويق وإدارة حسابات التواصل الاجتماعي | نقص المعرفة/المهارة في إدارة المتجر,كورس رقمي عن التسويق الذكي لمساعدة المتجر على النمو.
