id,name,type,status,price,sale_price,currency,category,url,sold_quantity,rating,problems_solved,description
802391701,ربط  واضافة تطبيق Google merchant center,service,sale,149,,SAR,ربط الخدمات,https://salatips.com/ar/ربط-google-merchant-center-في-متجرك-الأكتروني/p802391701,22,5,خيارات دفع محدودة / لا يوجد تقسيط | لا يوجد تتبع/تحليلات للزوار والأداء | ضعف التسويق وإدارة حسابات التواصل الاجتماعي | الحاجة لتقييم/تحليل شامل للمتجر,يتيح لك جوجل ميرشنت سنتر تنزيل بيانات متجرك الإلكتروني والمنتجات المتوفرة عليه إلى جوجل للتسوق (جوجل شوبينج)، حيث يساعد هذا الأمر على تسهيل العثور على متجرك وجذب المشترين أثناء إجراء عمليات البحث عبر قوقل. 🔎 والأمر ضروري لإنشاء حملات شوبينغ على جوجل، مما يساعدك في زيادة مدى وصول عملائك وزيادة المبيعات. 🚀💰💼 الخدمة تشمل : 1️⃣ يتيح لك Google Merchant Center رفع وإدارة مجموعة واسعة من المنتجات الخاصة بك، بما في ذلك الوصف والصور والأسعار والمعلومات الأخرى المتعلقة بالمنتجات.📦 2️⃣ بفضل توفر منتجاتك على Google Merchant Center، ستظهر منتجاتك في نتائج البحث ومتجر Google Play وشبكة العرض الإعلاني، مما يساعد عملائك في العثور على منتجاتك بسهولة وزيادة فرصة البيع.🌐 3️⃣ توفر لك Google Merchant Center مجموعة متنوعة من الإحصاءات والتقارير المفصلة حول أداء منتجاتك وإعلاناتك.📊 4️⃣ يمكنك تتبع عدد النقرات ومعدل التحويل والعوائد على الإعلانات، مما يساعدك في تحليل وتحسين استراتيجيات التسويق الخاصة بك.📈 5️⃣ ستتمكن من تحقيق توفير الوقت والجهد في إدارة وتسويق منتجاتك.⏳ 6️⃣ بفضل وجود منتجاتك على منصات Google المتنوعة، ستتمكن من الوصول إلى جمهور أوسع من العملاء المحتملين في مختلف الأماكن والأوقات. 🌍 ملاحظة : مدة انجاز الخدمة: من 24- 48 ساعة. لماذا تختار خبراء المنصات لتنفيذ هذه الخدمة؟ 1️⃣ يمتلك فريقنا خبرة ومهارة في ربط تطبيق Google Merchant Center . ويتمتعون بفهم عميق وخبرة واسعة في Google Merchant Center. 2️⃣ لدينا سمعة جيدة في تقديم خدمات عالية الجودة وتحقيق نتائج ملموسة. 3️⃣ موثوقون في منصة الأعمال. 4️⃣ نحن نضمن تقديم خدمة عالية الجودة. 5️⃣ نحن نقدر وقتك وأعمالك، ونلتزم بتقديم الخدمة وفقًا للمواعيد المحددة. سنعمل بجدية لضمان تسليم الخدمة في الوقت المناسب. 6️⃣ نحرص على توفير خدمات ذات جودة عالية. 7️⃣ نقدم مجموعة متنوعة من خيارات الدفع المرنة. الأسئلة الشائعة 1️⃣ ما هو Google Merchant Center؟ Google Merchant Center هو منصة تمكن التجار والمتاجر عبر الإنترنت من رفع معلومات منتجاتهم إلى Google. تُستخدم هذه المعلومات في إعلانات Google Shopping وغيرها من الخدمات لزيادة وجود منتجاتهم على الإنترنت. 2️⃣ ما هي المعلومات الأساسية التي نوفيرها في Google Merchant Center؟ نحن نعمل على توفير معلومات حول منتجاتك مثل الصور الجيدة والوصف والأسعار والتوفر. هذه المعلومات تساعد Google على عرض منتجاتك في نتائج البحث والإعلانات. 3️⃣ ما هو تأثير استخدام Google Merchant Center على مبيعاتي؟ يمكن أن يساعد استخدام Google Merchant Center في زيادة وجود منتجاتك على الإنترنت وبالتالي زيادة فرص العثور على متجرك وزيادة المبيعات. ومع ذلك، يعتمد التأثير على جودة المعلومات التي تقدمها واستراتيجيتك الإعلانية. 🚀 هل ترغب في تحقيق نجاح كبير في عملك عبر الإنترنت؟ 🌐 💰 لا تفوت الفرصة لتحقيق نجاح مميز في عالم التجارة الإلكترونية. احصل على خدمة Google Merchant Center اليوم وابدأ في تحقيق أهدافك التجارية بفعالية🌟📈
1915341690,انشاء ايميل احترافي مطابق للدومين,service,sale,119,,SAR,ربط الخدمات,https://salatips.com/ar/انشاء-ايميل-احترافي-مطابق-للدومين/p1915341690,20,0,عدم وجود دومين/نطاق خاص بالمتجر | خيارات دفع محدودة / لا يوجد تقسيط | ضعف التسويق وإدارة حسابات التواصل الاجتماعي,خدمة إنشاء البريد الإلكتروني الاحترافي المطابق للدومين 📧🌐 هي خدمة مهمة نوفرها للأفراد والشركات بهدف إنشاء حسابات بريد إلكتروني تمثل هويتكم الرقمية بشكل احترافي ومطابقة لعنوان دومين موقعكم على الويب. يُعتبر هذا البريد الإلكتروني أداة أساسية في التواصل الإلكتروني والتسويق الرقمي ويمكن أن يكون له تأثير كبير على الانطباع الأول للعملاء والعملاء المحتملين. 💼📈 الخدمة تشمل : 1️⃣ تساعدك الخدمة في اختيار وحصر اسم الدومين الذي يتناسب مع هويتك أو علامتك التجارية . 2️⃣ تشمل الخدمة إعداد حسابات البريد الإلكتروني بناءً على الدومين المحدد وتخصيصها لك ولمستخدميك. 3️⃣ تتيح لك الخدمة تخصيص الإعدادات البريدية مثل التوقيعات الإلكترونية والردود التلقائية وقواعد التصفية والمزيد. 4️⃣ تقدم الخدمة حلاً شاملاً لأمان البريد الإلكتروني، بما في ذلك التشفير ومكافحة البريد العشوائي (السبام) وحماية ضد الفيروسات والتهديدات الأمنية الأخرى. 5️⃣ تتضمن الخدمة خدمة دعم فني لمساعدتك في حل المشكلات أو الاستفسارات المتعلقة بخدمة البريد الإلكتروني. 🛡️💬 ما المميزات و الفوائد التي ستحصل عليها بعد شرائك للخدمة : 1️⃣ ستتيح لك هذه الخدمة إنشاء بريد إلكتروني يعكس هويتك أو علامتك التجارية بشكل محترف ومتطور. 📧 2️⃣ يمكن أن يزيد البريد الإلكتروني المطابق للدومين من مستوى الثقة لدي العملاء والشركاء التجاريين. 🤝 3️⃣ تتيح لك هذه الخدمة التواصل بشكل فعّال مع العملاء والشركاء من خلال بريد إلكتروني احترافي ومخصص. 📈📩 4️⃣ ستحصل على حماية إضافية لبياناتك ومراسلاتك من خلال ميزات الأمان والتشفير. 🔐 5️⃣ تمكنك الخدمة من تخصيص إعدادات البريد الإلكتروني والميزات حسب احتياجاتك. 🛠️ 6️⃣ ستساعدك هذه الخدمة في زيادة احترافيتك وجاذبيتك لعملاء جدد ومحتملين. 📊 7️⃣ يمكنك تنظيم مراسلاتك وجداول أعمالك بشكل أفضل من خلال تقديم أدوات إدارة متقدمة. 📝 8️⃣ في حالة وجود مشاكل أو استفسارات، يمكنك الاعتماد على دعم فني متخصص لمساعدتك. 🤝 لماذا تختار خبراء المنصات لتنفيذ هذه الخدمة؟ 1️⃣ لدينا فريق من الخبراء والمتخصصين في مجال، الذين يتمتعون بخبرة واسعة. 2️⃣ لدينا سمعة جيدة في تقديم خدمات عالية الجودة وتحقيق نتائج ملموسة. 3️⃣ موثوقون في منصة الأعمال. 4️⃣ نحن نضمن تقديم خدمة عالية الجودة. 5️⃣ نحن نقدر وقتك وأعمالك، ونلتزم بتقديم الخدمة وفقًا للمواعيد المحددة. سنعمل بجدية لضمان تسليم الخدمة في الوقت المناسب. 6️⃣ نحرص على توفير خدمات ذات جودة عالية. 7️⃣ نقدم مجموعة متنوعة من خيارات الدفع المرنة. الأسئلة الشائعة 1 ما هي أهمية البريد الإلكتروني الاحترافي المطابق للدومين؟ يساهم البريد الإلكتروني المطابق للدومين في بناء هوية احترافية وموثوقة على الإنترنت وزيادة مستوى الثقة بين العملاء والشركاء التجاريين. كما يوفر وسيلة آمنة ومخصصة للتواصل الإلكتروني. 2 هل يمكنني استخدام البريد الإلكتروني المطابق للدومين مع خدمات الاستضافة الخاصة بموقعي على الويب؟ نعم، يمكنك تكامل البريد الإلكتروني المطابق للدومين مع خدمات الاستضافة الخاصة بموقع الويب الخاص بك لإنشاء تجربة متكاملة للعملاء. 3 هل هناك ميزات أمان إضافية مع هذه الخدمة؟ نعم، تتضمن هذه الخدمة ميزات أمان مثل التشفير ومكافحة البريد العشوائي (السبام) وحماية ضد الفيروسات لضمان أمان البريد الإلكتروني والمراسلات. 4 هل تقدم الخدمة دعمًا فنيًا؟ نعم، غالبًا ما توفر خدمات البريد الإلكتروني المطابق للدومين دعمًا فنيًا لمساعدتك في حل المشاكل أو الاستفسارات المتعلقة بالخدمة. لا تضيع الفرصة احصل على البريد الإلكتروني المطابق للدومين الآن وابدأ في تحقيق الاحترافية والثقة على الإنترنت. 🚀📈
1266980061,إدارة منصات التواصل الاجتماعي لمدة 3 أشهر,service,sale,3500,,SAR,إدارة منصات التواصل الإجتماعي,https://salatips.com/ar/إدارة-صفحاتك-على-وسائل-التواصل-الاجتماعي/p1266980061,19,5,تصميم وواجهة المتجر غير احترافية / تجربة استخدام ضعيفة | لا يوجد تتبع/تحليلات للزوار والأداء | ضعف التسويق وإدارة حسابات التواصل الاجتماعي | منتجات ناقصة أو أوصاف/تصوير ضعيف | الحاجة لتقييم/تحليل شامل للمتجر | نقص المعرفة/المهارة في إدارة المتجر,هل تبحث عن إدارة احترافية ومستقرة لحساباتك لمدة 3 أشهر كاملة تضمن لك استمرارية ونمو حقيقي 🤝📈 خدمة إدارة منصات التواصل الاجتماعي لمدة 3 أشهر مصممة للعلامات اللي تبغى تبني حضور قوي بخطة واضحة، محتوى منظم، وتحليل مستمر للأداء. الخدمة تشمل : 📱 إدارة ثلاث منصات من اختيارك (انستغرام، تيك توك، سناب شات، إكس). 📅 إعداد جدول نشر احترافي لمدة 90 يوم بمحتوى يناسب نشاطك ويخاطب جمهورك المستهدف. 🎨 تصميم 30 منشور احترافي يعكس هوية نشاطك ويعزز صورتك أمام العملاء. 🎬 مونتاج 15 فيديو قصير مناسب لطبيعة كل منصة ويواكب أسلوبها. 📲 إنشاء 20 ستوري تفاعلي وجذاب لتعزيز التواصل اليومي مع المتابعين. 🎯 تقديم استشارة مجانية واحدة خلال مدة الخدمة لمراجعة الأداء أو تطوير الاتجاه التسويقي. 📊 تقارير أداء شهرية توضح أهم الإحصائيات، نقاط القوة، وفرص التحسين. ما هي المميزات والمنافع التي ستحصل عليها بعد شرائك الخدمة 🌟 تعمل مع فريق متخصص يخطط ويحلل وينفذ باحتراف. ⏳ تتفرغ لتطوير نشاطك بينما نتولى إدارة المحتوى والنشر والمتابعة. 🎯 استراتيجية ممتدة لمدة 90 يوم تعطي استقرار ونمو تدريجي مدروس. 📈 متابعة دقيقة للأرقام وتحسين الأداء شهر بعد شهر. 📣 تعزيز الوعي بعلامتك التجارية وبناء صورة احترافية قوية. 🗣️ رفع مستوى التفاعل من خلال محتوى متنوع ومنظم. 🚀 استثمار طويل المدى في بناء حضور رقمي ثابت ومؤثر. لمن هذه الخدمة : 🛍️ المتاجر الإلكترونية اللي تبغى نمو مستقر ومستمر. 🏢 الشركات الصغيرة والمتوسطة الراغبة في تعزيز انتشارها. 🚀 المشاريع الناشئة التي تحتاج خطة واضحة لثلاثة أشهر. 🎯 العلامات التجارية التي تستهدف بناء مكانة قوية في السوق. ملاحظات مهمة: 1️⃣ الخدمة تشمل إدارة ثلاث منصات فقط ويتم تحديدها قبل البدء. 2️⃣ المحتوى يتم بناؤه حسب طبيعة نشاطك وأهدافك التسويقية. 3️⃣ الفيديوهات تشمل مونتاج بدون تصوير ميداني احترافي. 4️⃣ التقارير تقدم نهاية كل شهر مع توصيات عملية. 5️⃣ الاستشارة المجانية يتم تحديد موعدها بالتنسيق خلال مدة الخدمة. لماذا تختار خبراء المنصات لتنفيذ هذه الخدمة؟ 1️⃣ خبرة عملية في إدارة الحسابات وبناء استراتيجيات نمو فعالة. 2️⃣ خطة محتوى واضحة ومجدولة لضمان الاستمرارية. 3️⃣ تركيز على النتائج الفعلية وليس مجرد نشر محتوى. 4️⃣ التزام كامل بالمواعيد وجودة التنفيذ. 5️⃣ شفافية في عرض النتائج وتحليل البيانات. 6️⃣ تطوير مستمر للاستراتيجية بناءً على أداء الحسابات. 7️⃣ تواصل مباشر واحترافي طوال مدة الثلاثة أشهر. الأسئلة الشائعة ؟ 1️⃣ هل أستطيع تغيير إحدى المنصات أثناء التنفيذ؟يتم تحديد المنصات مسبقًا، وأي تعديل يتم دراسته حسب المرحلة الحالية من العمل. 2️⃣ هل المحتوى مخصص بالكامل لنشاطي؟ نعم، يتم إعداد كل المحتوى بناءً على نشاطك وجمهورك وأهدافك. 3️⃣ هل تضمنون زيادة المتابعين؟ نركز على نمو طبيعي وتفاعل حقيقي يخدم نشاطك على المدى الطويل. 4️⃣ هل تشمل الخدمة الرد على الرسائل والتعليقات؟ يمكن الاتفاق على ذلك قبل البدء حسب احتياجك. 5️⃣ ما فائدة مدة الثلاثة أشهر؟ تعطي وقت كافي لاختبار الاستراتيجية، تحليل النتائج، وتحقيق نمو مستقر. 6️⃣ كيف يتم قياس النجاح؟ من خلال معدل التفاعل، الوصول، نمو المتابعين، وتحسن مؤشرات الأداء العامة. 7️⃣ هل يمكن إضافة إعلانات ممولة؟ نعم، يمكن إضافة إدارة حملات إعلانية باتفاق منفصل. 8️⃣ هل يمكن طلب تعديلات على التصاميم؟ نعم، يتم توفير عدد مناسب من التعديلات لضمان رضاك. 9️⃣ متى أبدأ ألاحظ النتائج؟ تبدأ المؤشرات بالتحسن تدريجيًا خلال الشهر الأول مع وضوح أكبر في الشهرين التاليين. إذا كنت تبغى حضور رقمي قوي واستراتيجية ممتدة تبني لك اسم ثابت في السوق احجز الآن وخلنا نبدأ رحلة نمو حقيقية لمدة 3 أشهر بثقة واحتراف 🤝📈
1500009003,خدمات خرائط قوقل Google Map,service,sale,599,,SAR,ربط الخدمات,https://salatips.com/ar/خدمات-خرائط-قوقل-google-map/p1500009003,19,0,ضعف الظهور في محركات البحث / قلة الزيارات (SEO) | الحاجة لتقييم/تحليل شامل للمتجر,خدمة إضافة المحل في خرائط قوقل تهدف إلى تحسين ظهور عملك على الإنترنت وزيادة وصول العملاء المحتملين إليك. تسهيل عملية الوصول إلى موقعك الفعلي يسهم بشكل كبير في جذب المزيد من الزبائن وبناء سمعة قوية. 🌍📍 📋🏦 متطلبات الخدمة: حساب على Google : يجب أن يكون لديك حساب Google للوصول إلى خدمة Google My Business. معلومات دقيقة عن المحل : مثل الاسم، العنوان، ساعات العمل، رقم الهاتف، وفئات الأعمال. صور واضحة : صور للمحل من الخارج والداخل لجذب العملاء. وثائق تثبت ملكية المحل : مثل عقود الإيجار أو فواتير الخدمات. ما هي المميزات والمنافع التي ستحصل عليها بعد شرائك الخدمة: 1️⃣ تحسين الظهور الرقمي : بفضل التسجيل، سيكون محلّك مرئيًا على خرائط قوقل، مما يسهل على العملاء العثور عليك. 2️⃣ زيادة العملاء المحتملين : الظهور على خرائط قوقل يزيد من احتمالية زيارة المزيد من العملاء لمحلّك. 3️⃣ تحسين سمعة الأعمال : يمكن للعملاء ترك تقييمات ومراجعات، مما يعزز من سمعة عملك إذا كانت التقييمات إيجابية. 4️⃣ معلومات محدثة : تستطيع تحديث معلومات عملك بسهولة، مثل ساعات العمل والعروض الخاصة. 5️⃣ سهولة الوصول : خرائط قوقل تساعد في توجيه العملاء إلى موقعك بدقة. 📌 ملاحظات: نحن هنا لمساعدتك في تسجيل وإدارة معلومات محلّك على خرائط قوقل، ونضمن تقديم خدمة عالية الجودة تعزز من ظهورك الرقمي وزيادة عملائك. 🚀💼 استفد من الفرص واستثمر في نجاح أعمالك! طلب خدمة إضافة المحل في خرائط قوقل الآن واستفد من الظهور والثقة التي ستمنحها لعملائك. سنكون هنا لدعمك في تحقيق أهدافك التجارية والتفوق على المنافسين. 🌟📈
77383064,ربط  واضافة متجرك الالكتروني على سلة مع منصة مخازن,service,sale,119,,SAR,ربط الخدمات,https://salatips.com/ar/ربط-متجرك-الإلكتروني-في-منصة-مخازن/p77383064,18,5,خيارات دفع محدودة / لا يوجد تقسيط | مشاكل أو نقص في إعداد الشحن والتوصيل | لا يوجد تتبع/تحليلات للزوار والأداء | ضعف التسويق وإدارة حسابات التواصل الاجتماعي | ربط أنظمة مخزون/دروبشيبينغ خارجية,خدمة ربط متجرك الإلكتروني على سلة مع منصة المخازن تتيح لك تكاملًا سلسًا بين متجرك الإلكتروني ونظام إدارة المخازن الخاص بك. 🔄 تهدف هذه الخدمة إلى تسهيل عملية إدارة المخزون وتحسين كفاءة العمل في متجرك الإلكتروني من خلال توفير ربط مباشر وآلي بين المتجر ونظام المخازن. 📈🔗 ما هي المميزات والمنافع التي ستحصل عليها بعد شرائك الخدمة ✅ إنشاء حساب على منصة المخازن وربط متجرك الإلكتروني مع المنصة وضبط جميع الإعدادات بسهولة. ⏳ ستقلل من الجهد اليدوي المطلوب لإدارة المخزون وتحديثاته في كلا الأنظمة، مما يوفر الوقت والجهد. 💼 ستتيح لك تركيز وقتك وجهودك في أمور أخرى مهمة لنجاح عملك، مثل تحسين تجربة العملاء وتطوير استراتيجيات التسويق. 🔗 نضمن لك التكامل التلقائي بين المتجر الإلكتروني ونظام المخازن، مما يقلل من اختلافات أو تباين في المعلومات ويزيد من دقة البيانات. 📊 يساعدك في تحقيق دقة عالية في تتبع المخزون ومعرفة الكميات المتاحة في الوقت الحقيقي. 🛍 ستتمكن من تحسين تجربة التسوق لعملائك وزيادة الثقة بهم من خلال إظهار المنتجات المتاحة بشكل دقيق وتحديث الكميات فوريًا. 📈 يمكنك استخدام بيانات المخزون المحدثة تلقائيًا لاتخاذ قرارات استراتيجية حكيمة بشأن إدارة المخزون وتحسين عمليات الإعادة الشحن والتوزيع. 💰 من خلال الحصول على رؤية دقيقة ومحدثة للمخزون، يمكنك تجنب التخزين الزائد والتوزيع الغير فعّال، مما يقلل من التكاليف الإجمالية لعملك. ملاحظات 1 الخدمة لا تشمل رفع المنتجات وتعديل الأقسام ( راجع تطويرات الخدمة أسفله ) 📦 2 مدة انجاز الخدمة: من 24- 48 ساعة. ⏰ لماذا تختار خبراء المنصات لتنفيذ هذه الخدمة؟ 1️⃣ يمتلك فريقنا خبرة ومهارة في إضافة فيسبوك بيكسل لمتجرك الإلكتروني . ويتمتعون بفهم عميق وخبرة واسعة في فيسبوك بيكسل. 2️⃣ لدينا سمعة جيدة في تقديم خدمات عالية الجودة وتحقيق نتائج ملموسة. 3️⃣ موثوقين في منصة الأعمال. 4️⃣ نحن نضمن تقديم خدمة عالية الجودة. 5️⃣ نحن نقدر وقتك وأعمالك، ونلتزم بتقديم الخدمة وفقًا للمواعيد المحددة. سنعمل بجدية لضمان تسليم الخدمة في الوقت المناسب. 6️⃣ نحرص على توفير خدمات ذات جودة عالية. 7️⃣ نقدم مجموعة متنوعة من خيارات الدفع المرنة. الأسئلة الشائعة 1 ما هي منصة مخازن (Mokazen)؟ منصة مخازن هي منصة تساعد على إدارة المخزون والأمور المالية والشحن والتوزيع لمتاجر الإنترنت. توفر حلاً شاملاً لأصحاب المتاجر الإلكترونية لتسهيل عملياتهم. 2 ما الفوائد التي يمكن أن أحصل عليها من خلال ربط متجري بمنصة مخازن؟ الفوائد تتضمن إمكانية تتبع المخزون بشكل دقيق، وإدارة عمليات الشحن والتوزيع بكفاءة، وتوليد تقارير مالية دقيقة، وتحسين تجربة العملاء من خلال توفير معلومات حول توافر المنتجات وأوقات التسليم. 3 ما هي المتطلبات الأساسية لاستخدام منصة مخازن؟ تعتمد المتطلبات على المنصة الخاصة بك ومزود الخدمة الذي تستخدمه، ولكن عادة ما تتضمن المتطلبات وجود حساب على منصة مخازن وتكوين التكامل مع متجرك الإلكتروني. أشتري الخدمة الآن واجعل متجرك الإلكتروني يعمل بكفاءة عالية ويوفر تجربة تسوق مميزة لعملائك 💻📦
